Index;Tweet;HS;Abusive;HS_Individual;HS_Group;HS_Religion;HS_Race;HS_Physical;HS_Gender;HS_Other;HS_Weak;HS_Moderate;HS_Strong;Tweet_Parsed;HS_predict;Abusive_predict;HS_Individual_predict;HS_Group_predict;HS_Religion_predict;HS_Race_predict;HS_Physical_predict;HS_Gender_predict;HS_Other_predict;HS_Weak_predict;HS_Moderate_predict;HS_Strong_predict
2799;"dilema hp wafat disaat bokap nyokap lg dinas luar pulau dan adek lg ikut pengkaderan jd ga pulang2 dan lo sendirian dirumah.. wah edan kali kau nuy :"")'";0;1;0;0;0;0;0;0;0;0;0;0;dilema handphone wafat di saat bapak ibu lagi dinas luar pulau dan adik lagi ikut pengaderan jadi tidak pulang pulang dan kamu sendirian di rumah  gila kali kamu nuy ;0;0;0;0;0;0;0;0;0;0;0;0
2800;fuck off la let me teach you how to be bitch and stop ruin my relay bangsat,,,,;1;1;1;0;0;0;0;0;1;1;0;0;fuck off  let me teach you how to be bitch and stop ruin my relay bangsat ;0;1;0;0;0;0;0;0;0;0;0;0
2801;USER USER ,,, Ahok paham, bhw PB nya akan dijadikan bahan utk menyerang p Jokowi oleh kelompok bani Togel 212 kang ,,, spt halny pemberian remisi kpd Napi : 1. Teroris, Koruptor dan Narkoba kang ,,, jd P Ahok ingin bebas murni, spy tdk ada;1;0;1;0;0;0;0;0;1;1;0;0;user user ahok paham bahwa pb  akan dijadikan bahan untuk menyerang p jokowi oleh kelompok bani togel kakak seperti halnya pemberian remisi kepada napi teroris koruptor dan narkoba kakak jadi p ahok ingin bebas murni supaya tidak ada;1;0;0;1;0;0;0;0;1;0;0;0
2802;Kalo seumpama orang cina di usir paksa dari indonesia gimana;1;0;0;1;0;1;0;0;0;0;1;0;kalau seumpama orang cina di usir paksa dari indonesia bagaimana;1;0;0;1;0;1;0;0;0;0;0;1
2808;well-o I'm feeling like a loser now, since I didn't participate at #indonesiaelection;0;1;0;0;0;0;0;0;0;0;0;0;well o i sama feeling like a loser now sejak i did not participate at indonesia election;0;0;0;0;0;0;0;0;0;0;0;0
2809;Cewe berengsek fuck you .;1;1;1;0;0;0;0;0;1;1;0;0;wanita berengsek fuck you ;0;1;0;0;0;0;0;0;0;0;0;0
2811;USER Elu,omong apa culun??';1;1;1;0;0;0;0;0;1;1;0;0;user kamu omong apa culun ;1;1;1;0;0;0;0;0;0;1;0;0
2812;You faithful and pious servant of Chinese! How much do they pay for you to slander Uyghurs? You are a munafik.;1;0;1;0;0;0;0;0;1;1;0;0;you faithful and pious servant of cina how much do they pay for you to slander uyghurs you are a munafik ;0;0;0;0;0;0;0;0;0;0;0;0
2813;"Prabowo's fragile coalition has been hijacked by hardliner groups: PKS, HTI & FPI; his nationalist GRINDRa partymen are unhappy. Prabowo also often fails to turn up to rallies due to poor health.

Breaking: SBY's Democrat Party may consider shifting its allegiance to Jokowi soon.";1;0;0;1;1;0;0;0;0;0;1;0;prabowo fragile coalition has been hijacked by hardliner groups partai keadilan sejahtera hizbut tahrir indonesia front pembela islam his nasionalis gerindra partymen are unhappy prabowo also often fails to turn up to rallies due to poor health istirahat susilo bambang yudhoyono democrat party mau consider shifting it is allegiance to jokowi soon ;1;0;0;1;0;0;0;0;0;0;0;0
2814;USER pecun ku URL;0;1;0;0;0;0;0;0;0;0;0;0;user pecun aku url;0;1;0;0;0;0;0;1;0;0;0;0
2815;USER Bacot reza, urusin saja anak istrimu itu! Etapi garagara reply anda saya jadi galau lagi\xf0\x9f\x98\xad';1;1;1;0;0;0;0;0;1;1;0;0;user bacot reza uruskan saja anak istrimu itu tetapi gara gara reply kamu saya jadi galau lagi ;1;1;1;0;0;0;0;0;0;1;0;0
2817;Death to FPI, death to HTI, death to all radicals #IndonesiaNotSyria;1;0;0;1;1;0;0;0;0;0;0;1;death to front pembela islam death to hizbut tahrir indonesia death to all radikal indonesia not syria;0;0;0;0;0;0;0;0;0;0;0;0
2819;Hee? Bukannya kader situ yg ngomong mulu lebih tepatnya ngetwitt mulu tanpa faedah URL;1;0;1;0;0;0;0;0;1;1;0;0;he bukannya kader kamu  bicara mulu lebih tepatnya mentwit mulu tanpa faedah url;1;1;0;0;0;0;0;0;0;0;0;0
2821;Boleh bodo tgk taik manusia ni \xf0\x9f\x98\x86 URL;1;1;1;0;0;0;0;0;1;1;0;0;boleh bodoh tegak tai manusia nih url;0;1;0;0;0;0;0;0;0;0;0;0
2824;The real champion is not you Malaysia #ShameOnYouMalaysia;1;0;0;1;0;0;0;0;1;0;1;0;the real champion is not you malaysia shame on you malaysia;1;0;0;0;0;0;0;0;1;0;0;0
2830;"USER Iyaa komunitas muslim &amp; budha bareng2 sediain makanan buat rescuers nya jg. Di saat disini hal apapun dijadiin panggung politik.'";1;0;0;1;0;0;0;0;1;0;1;0;user iya komunitas muslim buddha bareng bareng sediakan makanan buat rescuers  juga di saat di sini hal apapun dijadikan panggung politik ;0;0;0;0;0;0;0;0;0;0;0;0
2832;gue udh di stage where i explicitly dont like him and idgaf lmaooo ð tetangga gue ada yg meninggal gara2 banjir hari ini, sodara gue rumahnya kelelep. i just choose not to spend my time arguing with sumbu pendek, but i judge them still wkkw i judge them bad :/;1;0;1;0;0;0;0;0;1;1;0;0;aku sudah di stage where i explicitly do not like him and i do not give a fuck laughing my ass off tetangga aku ada  meninggal gara gara banjir hari ini saudara aku rumahnya kelelep i just choose not to spend my time arguing dengan sumbu pendek but i judge them still  i judge them bad ;0;1;0;0;0;0;0;0;0;0;0;0
2833;Shame On You!!! Justice Nowhere???  USER!! PLS  USER  USER  USER  USER  USER  USER  USER  USER  USER #shameonyoumalaysia #ShameOnYouSyedSaddiq https://twitter.com/spartacks_spfc/status/1197894726415814656Â â¦;1;0;0;1;0;0;0;0;1;0;1;0;shame on you justice nowhere user tolong user user user user user user user user user shame on you malaysia shame on you syed saddiq ;1;0;0;0;0;0;0;0;1;0;0;0
2834;Worth to watch. Cant believe we have that bejat person rule the best airlines in Indonesia  https://twitter.com/digeeembok/status/1201777904264216576Â â¦;1;1;1;0;0;0;0;0;1;1;0;0;worth to watch cant believe we have that bejat person rule the best airlines in indonesia ;0;1;0;0;0;0;0;0;0;0;0;0
2839;"Saudaraku,; ; JIKA MASIH ADA KECINTAAN PADA AGAMA DAN NEGARA INI,; UMAT ISLAM BANGKITLAH DAN BERGERAK !!!; ; #2019GantiPresiden; Satukan Gerak; #2019PresidenBaru";1;0;0;1;1;0;0;0;0;0;0;1;saudaraku jika masih ada kecintaan pada agama dan negara ini umat islam bangkitlah dan bergerak ganti presiden satukan gerak presiden baru;1;0;0;0;0;0;0;0;0;0;0;0
2848;Kenapa USER bicaranya sesuatu yg remeh temeh spt masalah kalajengking krn belio tau oposisinya spt USER itu pasti nyinyir jd stress dan stroke sendiri...krn emang dosen ga laku...bacot gede hasil karya ga ada... bahkan anak asuhnya mayor dungu;1;1;0;1;0;0;0;0;1;0;1;0;kenapa user bicaranya sesuatu  remeh temeh seperti masalah kalajengking karena dia tau oposisinya seperti user itu pasti nyinyir jadi stres dan strok sendiri karena memang dosen tidak laku bacot besar hasil karya tidak ada bahkan anak asuhnya mayor dungu;1;1;0;0;0;0;0;0;1;0;0;0
2850;RT USER USER Satu hal USER sama kader-kader sama gobloknya.;1;1;0;1;0;0;0;0;1;0;1;0;rt user user satu hal user sama kader kader sama gobloknya ;1;0;0;0;0;0;0;0;0;0;0;0
2855;isn't it by making tweets like #PrabowoWinRealCount #PrabowoGila #KpuJanganCurang everyone in the world knows how the quality of people +62? so sad.;1;1;0;1;0;0;0;0;1;0;1;0;is not it by making twit like prabowo win real count prabowo gila komisi pemilihan umum jangan curang everyone in the world tahu how the quality of people so sad ;0;1;0;0;0;0;0;0;0;0;0;0
2856;"USER Yg bikin aku makin kayak minder gt loh pot. ""Pipi tumpah"" brengsek tirus gt apa perlu gue sodorin pipi gue sih biar dia tau definisi ""tembem"" tuh gmn soalnya di kamus jg gaada gambar jd mereka ngide aja, pengen dipuji jg dalam ati.'";1;1;1;0;0;0;0;0;1;1;0;0;user  buat aku semakin kayak minder begitu  pot pipi tumpah berengsek tirus begitu apa perlu aku sodori pipi aku  biar dia tau definisi tembem itu bagaimana soalnya di kamus juga tidak ada gambar jadi mereka memberi ide saja ingin dipuji juga dalam hati ;0;1;0;0;0;0;0;0;0;0;0;0
2858;USER Kapan kita adzanin nih mulut jamban.';1;1;1;0;0;0;0;0;1;1;0;0;user kapan kita azankan nih mulut jamban ;0;0;0;0;0;0;0;0;0;0;0;0
2862;USER sepertinya dia dari Nu cabang kristen .';1;0;1;0;1;0;0;0;0;1;0;0;user sepertinya dia dari nu cabang kristen ;0;0;0;0;0;0;0;0;0;0;0;0
2864;Itu juga boleh bila perlu lengserkan ni orang pada dasarnya pengecut jokowi;1;0;1;0;0;0;0;0;1;1;0;0;itu juga boleh bila perlu lengserkan nih orang pada dasarnya pengecut jokowi;1;0;1;0;0;0;0;0;1;0;0;1
2867;Bangsat, Rocky Gerung Pendukung 212 Sebut Kitab Suci Itu Fiksi, Al-Quran Fiksi? Laknat Kau!;1;1;1;0;1;0;0;0;0;1;0;0;bangsat rocky gerung pendukung sebut kitab suci itu fiksi al alquran fiksi laknat kamu ;1;1;0;1;1;0;0;0;0;0;0;0
2870;Kita susah berharap pada partai pendukung pemerintah krna mereka sdh terbukti jadi pendukung setia ahok si penista agama. Musuh umat islam;1;0;0;1;1;0;0;0;0;0;1;0;kita susah berharap pada partai pendukung pemerintah karena mereka sudah terbukti jadi pendukung setia ahok  penista agama musuh umat islam;1;0;0;0;0;0;0;0;0;0;0;0
2872;10 orang terkaya indo. 1 sampai 5 bukan orang indonesia . tapi orang cina . ngerih kalo indonesia kaya singapur nanti yang pribumi di usir;1;0;0;1;0;1;0;0;0;0;1;0; orang terkaya indonesia sampai bukan orang indonesia tapi orang cina mengerikan kalau indonesia kaya singapura nanti  pribumi di usir;1;0;0;1;0;1;0;0;0;0;0;1
2874;Bang Adian pernah bilang, sebelum berniat Ganti Presiden tentukan dulu siapa lawannya Pak Jokowi di 2019.\nbaru adu program.';0;0;0;0;0;0;0;0;0;0;0;0;bang adian pernah bilang sebelum berniat ganti presiden tentukan dulu siapa lawannya pak jokowi di baru adu program ;1;0;1;0;0;0;0;0;1;0;0;0
2875;Keputusan ERKA hari ini harus kita HORMATI, begitupun sebaliknya KAMI tidak akan memilih partai pendukung PENISTA AGAMA.;1;0;0;1;1;0;0;0;0;0;1;0;keputusan erka hari ini harus kita hormati begitupun sebaliknya kami tidak akan memilih partai pendukung penista agama ;1;0;0;1;0;0;0;0;0;0;1;0
2876;USER Ahhh , ulama karbitan gomong gak pernah membawa kesejukan , banyak membaca dan belajar dari kehidupan nabi biar gak tulalittttt .;1;1;1;0;1;0;0;0;0;1;0;0;user  ulama karbitan bicara tidak pernah membawa kesejukan banyak membaca dan belajar dari kehidupan nabi biar tidak tulalit ;0;0;0;0;0;0;0;0;0;0;0;0
2877;I just ordered a batch of Coronavirus masks im wearing at all tines #fuck #China eating bats and snakes & feeding their toddlers live tadpoles fuck China off;1;1;0;1;0;0;0;0;1;0;1;0;i just ordered a batch of coronavirus masks i am wearing at all tines fuck cina eating bats and snakes feeding their toddlers live tadpoles fuck cina off;0;1;0;0;0;0;0;0;0;0;0;0
2878;USER Sehat om?????klo ga sehat minum kencing onta dulu';0;1;0;0;0;0;0;0;0;0;0;0;user sehat om kalau tidak sehat minum kencing unta dulu ;1;1;0;0;0;0;0;0;0;0;0;0
2882;Yes exactly. All they do is preach hate ! If not yahudi its shia, if not shia its other religion/bangsa, if not them its LGBT..all the time. Disgusting radicalizers;1;0;0;1;0;0;0;0;1;0;1;0;iya exactly all they do is preach hate if not yahudi it is syiah if not syiah it is other religion bangsa if not them it is lesbian gay bisexual transgender all the time disgusting radicalizers;0;0;0;0;0;0;0;0;0;0;0;0
2883;USER USER PPP jd bangke ni 2019';1;1;0;1;0;0;0;0;1;0;1;0;user user partai persatuan pembangunan jadi bangkai nih ;0;0;0;0;0;0;0;0;0;0;0;0
2886;USER USER Corong Congor Cebong \nBiadab !!';1;1;0;1;0;0;0;0;1;0;1;0;user user corong congor kecebong biadab ;1;1;1;0;0;0;1;0;1;1;0;0
2888;"""Dit, mau abang kasih rahasia ga ?""\n""bang bim main sama kak chaca aja sana! Adit mau sendirian""\n""Eh dit serius, ntar kalau lo dengerin kata abang, gue ijinin maincraft deh""\n""TANTE JANI BANG BIMA BERISIK BANGET ! ""\n\ndasar bocah kampret URL";1;1;1;0;0;0;0;0;1;1;0;0;dit mau abang kasih rahasia tidak bang bim main sama kakak chaca saja sana adit mau sendirian  dit serius nanti kalau kamu dengarkan kata abang aku izinkan maincraft  tante jani bang bima berisik banget dasar bocah kampret url;0;1;0;0;0;0;0;0;0;0;0;0
2889;"The sad part is, there are a lot of people have already deeply planted with the justification of their propagandas, especially here in Indonesia.
Those 3s differentiated by:
HTI, soft doctrines. âï¸
FPI, moderate to hard. âï¸
ISIS, war mode. (We almost reach this point now). â";1;0;0;1;1;0;0;0;0;0;1;0;the sad part is there are a lot of people have already deeply planted dengan the justification of their propagandas especially here in indonesia those s differentiated by hizbut tahrir indonesia lembut doctrines front pembela islam moderate to hard isis war mode we almost reach this point now ;0;0;0;0;0;0;0;0;0;0;0;0
2890;Amerika Latin gila tiket Piala Dunia\n\nURL URL;0;0;0;0;0;0;0;0;0;0;0;0;amerika latin gila tiket piala dunia url url;0;1;0;0;0;0;0;0;0;0;0;0
2891;RT USER: Ustad goblog nih..dia ga tau ada kafir yg sunat.. umat Yahudi..bahkan dari bayi..ga kayak dia uda ngerti coli baru sunat..muka\xe2\x80\xa6';1;1;1;0;1;0;0;1;0;1;0;0;rt user ustad goblok nih dia tidak tau ada kafir  sunat umat yahudi bahkan dari bayi tidak kayak dia sudah mengerti coli baru sunat muka ;0;1;0;0;0;0;0;0;0;0;0;0
2894;USER USER Pdhal yg bikin ambang batas rezim Prihatin.. eh semua salah jokowi \xf0\x9f\x98\xb5';0;0;0;0;0;0;0;0;0;0;0;0;user user padahal  buat ambang batas rezim prihatin  semua salah jokowi ;1;0;1;0;0;0;0;0;1;0;0;0
2895;USER Jablay gitu bazeng:((';1;1;1;0;0;0;0;1;0;1;0;0;user jablay begitu anjir ;0;1;0;0;0;0;0;0;0;0;0;0
2896;USER USER USER .\nOnta mati klo kebanyakan Minum';1;0;0;1;0;0;0;0;1;0;1;0;user user user unta mati kalau kebanyakan minum ;1;1;1;0;0;0;0;0;0;1;0;0
2900;YASSSS! Call me out i wanna plant to. Imma show u my âkampungan' skill to plant the trees  https://twitter.com/abe_tembikai/status/1133593118471622657Â â¦;0;0;0;0;0;0;0;0;0;0;0;0;yassss call me out i ingin plant to i am going to show kamu my kampungan skill to plant the trees ;0;1;0;0;0;0;0;0;0;0;0;0
2902;ato Kalo tidak Fahri Hamzah di Usir dari DPR;1;0;1;0;0;0;0;0;1;0;0;1;atau kalau tidak fahri hamzah di usir dari dewan perwakilan rakyat;1;0;0;0;0;0;0;0;1;0;0;0
2904;Kalau stigma PKI, KOMUNIS, KAFIR, MUNAFIQ dan BABI boleh dilanjutkan ya bpk DPR? bhkn blh tuh teriak gantung, bunuh n usir WNI etnis cina;1;1;0;1;0;1;0;0;0;0;0;1;kalau stigma partai komunis indonesia komunis kafir munafik dan babi boleh dilanjutkan  bapak dewan perwakilan rakyat bahkan boleh itu teriak gantung bunuh dan usir warga negara indonesia etnis cina;1;0;0;1;0;1;0;0;0;0;0;0
2905;RT USER USER Bntr lg si joko jg nyungsep kyk ho ok. Nyantai aja kali.... Hehe;1;0;1;0;0;0;0;0;1;1;0;0;rt user user sebentar lagi  joko juga nyungsep seperti  oke bersantai saja kali ;1;0;1;0;0;0;0;0;0;0;0;0
2909;"USER Betull saya dagang aneh tapi nyata pada masa seharus nya harga 30rb per 1kg itu biasa nya bulan nasional idul fitri lebaran dll lah ini di luar hari trsbt malah 30rb aneh nya beras yang murah ;) rezim aneh'";1;0;1;0;0;0;0;0;1;1;0;0;user betul saya dagang aneh tapi nyata pada masa seharusnya  harga tiga puluh ribu per satu kilogram itu biasa  bulan nasional idul fitri lebaran dan lain lain  ini di luar hari tersebut malah tiga puluh ribu aneh  beras  murah rezim aneh ;0;0;0;0;0;0;0;0;0;0;0;0
2911;I hate everything and everything you do today!!! Anjing sama kalaian smua bangsat !!! Fuck ThatÃ°Å¸Â¤Â¬Ã°Å¸Â¤Â¬,,,,;1;1;0;1;0;0;0;0;1;0;1;0;i hate everything and everything you do today anjing sama kalian semua bangsat fuck that ;1;1;0;0;0;0;0;0;1;0;0;0
2912;"MAS has reached another level of self-hallucination,""Most Successful SG Ever"", R u fuckin kidding me? Twat... #ShameOnYouMalaysia  pic.twitter.com/tKcNIkTrNO";0;1;0;0;0;0;0;0;0;0;0;0;mas has reached another level of self hallucination paling successful sg ever r kamu fuck kidding me twat shame on you malaysia ;1;1;0;0;0;0;0;0;1;0;0;0
2915;Bajingan...bangsat... lo bukan siapa-siapa, kok sombong banget!!!!';1;1;1;0;0;0;0;0;1;1;0;0;bajingan bangsat kamu bukan siapa siapa  sombong banget ;1;1;1;0;0;0;0;0;1;0;0;0
2918;Banyaknya projo yang tendensius pd hal berbau islam ditambah hukum berat sebelah USER gak sadar bahwa merek rezim jd anti islam.;1;0;0;1;1;0;0;0;0;0;1;0;banyaknya promo  tendensius pada hal berbau islam ditambah hukum berat sebelah user tidak sadar bahwa merek rezim jadi anti islam ;0;0;0;0;0;0;0;0;0;0;0;0
2922;The only thing every one will remember about this #SEAGames2017 is how fuck up it really is #ShameOnYouMalaysia #à¸à¸µà¹à¸à¸¡à¸ªà¹2017;0;1;0;0;0;0;0;0;0;0;0;0;the only thing every one will remember about this sea games is how fuck up it really is shame on you malaysia ;0;0;0;0;0;0;0;0;0;0;0;0
2924;USER Pokcoy ih bloon nya pacar kuuu';1;1;1;0;0;0;0;0;1;1;0;0;user pakcoy  beloon  pacar aku ;0;1;0;0;0;0;0;0;0;0;0;0
2929;Mantri berengsek..Mmmm such a strong word..but its okay if it could calm u down...;1;1;1;0;0;0;0;0;1;1;0;0;mantri berengsek  such a strong word but it is ok if it could calm kamu down ;0;1;0;0;0;0;0;0;0;0;0;0
2930;USER bahkan penganut Islam Nusantara tak pernah megecam PKI';0;0;0;0;0;0;0;0;0;0;0;0;user bahkan penganut islam nusantara tidak pernah mengecam partai komunis indonesia ;1;0;0;1;0;0;0;0;0;0;0;0
2932;Idih nanya kok terakhir emange mo modar';0;1;0;0;0;0;0;0;0;0;0;0; bertanya  terakhir memangnya mau modar ;0;0;0;0;0;0;0;0;0;0;0;0
2936;USER USER USER neng..banjir rancaekek itu tanggung jawab pemerintah pusat...karna itu jalan nasional..banyak baca noh...jangan kaya cebong..diam dikolam aja..giliran laper baru nongol...';1;1;0;1;0;0;0;0;1;0;1;0;user user user neng banjir rancaekek itu tanggung jawab pemerintah pusat karena itu jalan nasional banyak baca itu jangan kaya kecebong diam di kolam saja giliran lapar baru nongol ;1;1;0;0;0;0;0;0;1;0;0;0
2937;"MUNAFIK LO PADA. FUCK U ALL!
WE ARE ONE?
ONE ARE WE?
ARE WE ONE? -THIS IS THE BITCH EVERYONE ASK TO EXOL.

#ìììì´_ë¯¿ë_ì²¸
#ìììì_ìì9ëª_ë¯¿ì´
#EXOLBelievesInEXO9";1;1;0;1;0;0;0;0;1;0;1;0;munafik kamu pada fuck kamu all we are one one are we are we one this is the bitch everyone tanya to exol exol believe in exo ;0;1;0;0;0;0;0;0;0;0;0;0
2938;bodoh. cemburu buta macam dah kawin';0;0;0;0;0;0;0;0;0;0;0;0;bodoh cemburu buta macam sudah kawin ;0;1;0;0;0;0;0;0;0;0;0;0
2941;Pak USER sehat? Jalan-jalan Pak... Yang aktif gitu lho menebar kebaikan seperti Presiden RI. Jangan manggung di kandang terus. Ngga bosen ketemunya Fadli Zon aja?;1;0;1;0;0;0;0;0;1;1;0;0;pak user sehat jalan jalan pak  aktif begitu  menebar kebaikan seperti presiden republik indonesia jangan manggung di kandang terus tidak bosan ketemunya fadli zon saja ;0;0;0;0;0;0;0;0;0;0;0;0
2942;Btw happy not heppy,kampunganðððð;0;0;0;0;0;0;0;0;0;0;0;0;by the way happy not happy kampungan ;0;1;0;0;0;0;0;0;0;0;0;0
2943;USER USER Gw pengen denger itu bocah yg banyak ngayal +mimpi basah komentarin ulah anak horang kaya itu.. Ayo bocah USER ,USER ntu presiden kita dihina';1;0;1;0;0;0;0;1;0;1;0;0;user user aku ingin dengar itu bocah  banyak berkhayal mimpi basah komentari ulah anak orang kaya itu ayo bocah user user itu presiden kita dihina ;0;0;0;0;0;0;0;0;0;0;0;0
2948;#MataNajwaDebatJakarta topeng anda hari ini fix terbuka USER .. anda sama dgn yg mendukung anda.. BAU BUSUK;1;1;1;0;0;0;0;0;1;1;0;0; mata najwa debat jakarta topeng kamu hari ini fix terbuka user kamu sama dengan  mendukung kamu bau busuk;1;1;1;0;0;0;0;0;0;1;0;0
2950;USER Anjing menggonggong anies jalan terus;1;1;1;0;0;0;0;0;1;1;0;0;user anjing menggonggong anies jalan terus;1;1;0;0;0;0;0;0;1;0;0;0
2953;Bangsat lah yang pada kebanyakan bacot disini, fuck every single word that comes from your mouth bitch,,,,;1;1;1;0;0;0;0;0;1;1;0;0;bangsat   pada kebanyakan bacot di sini fuck every single word that comes from your mouth bitch ;0;1;0;0;0;0;0;0;0;0;0;0
2955;USER USER BABI KAU INI YHA\nMUNGKIN LAHIR DARI BANI BABI KAU INI ,\nANJING LAH KAU INI ,\n\nKau Ngomong Mentei selangkangan\nTapi MAJIKAN KAU BINI NYE SELINGKUH 7 Tahun \nItu Yg cocok Mentri selangkangan\n7 tahun Coy ,\n\nHRS kau Tuduh begitu;1;1;1;0;0;0;0;0;1;1;0;0;user user babi kamu ini  mungkin lahir dari bani babi kamu ini anjing  kamu ini kamu bicara menteri selangkangan tapi majikan kamu bini  selingkuh tahun itu  cocok menteri selangkangan tahun  harus kamu tuduh begitu;1;1;0;0;0;0;0;0;1;0;0;0
2958;"i know you dont like it. korean. so just shut the fuck up. its my interest. they even came first, before you. make my day. make me laugh.

i just hold it inside. sabar gue ini sabar. jangan sampe gue katain lo bacot bangsat bangke amat ngata2in orang banci. kaya lo paling oke aja,,,,";1;1;1;0;0;0;0;0;1;1;0;0;i know you do not like it korean so just shut the fuck up it is my interest they even came first sebelum you make my day make me laugh i just hold it inside sabar aku ini sabar jangan sampai aku ejek kamu bacot bangsat bangkai amat memaki maki orang banci kaya kamu paling oke saja ;1;1;0;0;0;0;0;0;0;0;0;0
2963;When i said 'semua cowo sama aja bangsat kabeh' and they be like 'ayah kamu juga??' I'd definitely fckn say 'YES' cuz he just dumped the fuck out of me and mum. Yikezz,,,,;0;1;0;0;0;0;0;0;0;0;0;0;when i said emua pria sama saja bangsat semua and they be like bapak kamu juga i di definetly fuck say iya because he just dumped the fuck out of me and mum yikes ;1;1;0;0;0;0;0;0;0;0;0;0
2967;"USER USER USER USER Kaum otak cingkrang demen hoax maklum junjunganya prof abal2 dan ulama yg belajar di sekolahan kafir; ; G?k ada sejarahnya nu dukung khilafah. Knp merasa minoritas ya m?u nyari simpatisan dr nu... ; Dasar wa";1;1;0;1;1;0;0;0;0;0;1;0;user user user user kaum otak cingkrang suka hoaks maklum junjungannya prof abal abal dan ulama  belajar di sekolahan kafir tidak k ada sejarahnya nu dukung khilafah kenapa merasa minoritas  sama kamu mencari simpatisan dari nu dasar wa;1;1;0;1;0;0;0;0;0;0;0;0
2975;USER USER Gw kira gw doang yang diginiin. Tahunya ada yang laen juga. Bangke emang mereka ini sinyalnya. Mau ganti telkomsel tp saya orang miskin.';1;1;0;1;0;0;0;0;1;0;1;0;user user aku kira aku saja  dibeginikan tahunnya ada  lain juga bangkai memang mereka ini sinyalnya mau ganti telkomsel tetapi saya orang miskin ;0;0;0;0;0;0;0;0;0;0;0;0
2980;USER USER USER Lah sama aja ngawur kayaknya haha, saya mah gatau arti kafir, makanya saya lebih baik diem daripada sok ngide hehehe';0;0;0;0;0;0;0;0;0;0;0;0;user user user  sama saja ngawur kayaknya  saya  tidak tahu arti kafir makanya saya lebih baik diam daripada sok memberi ide  ;1;0;1;0;0;0;0;0;0;1;0;0
2984;Kepung Kantor LBH Jakarta;1;0;0;1;0;0;0;0;1;0;0;1;kepung kantor lebih jakarta;0;0;0;0;0;0;0;0;0;0;0;0
2985;USER perek doyan di gagahin :*';0;1;0;0;0;0;0;0;0;0;0;0;user perek suka di gagahi ;0;0;0;0;0;0;0;0;0;0;0;0
2986;UNDUR UNDUR FC mah culun ngaku nya team hebat tapi lawan PERSIB aja minta di undur hahahahaha FUCK JOKODRI!';1;1;0;1;0;0;0;0;1;0;1;0;undur undur fuck  culun mengakui  tim hebat tapi lawan persib saja meminta di undur  fuck joko driyono ;0;1;0;1;0;0;0;0;0;0;1;0
2987;"Haha w ngerasa jijik sm diri w sndr stlh melihat kmbali isi dm sm mantan w dirp haha alhamdulilah udh pny pcr inrl &amp; lbh bahagia gak fana\xf0\x9f\x98\x8c[]'";0;0;0;0;0;0;0;0;0;0;0;0; aku merasa jijik sama diri aku sindir setelah melihat kembali isi direct message sama mantan aku diri  alhamdulillah sudah punya pacar inrl lebih bahagia tidak fana ;0;1;0;0;0;0;0;0;0;0;0;0
2990;"Fuck you! But fuck i miss youÃ°Å¸ËÅ
-Arm12feb2k17Ã¢ï¿½Â¤Ã°Å¸'â Ã¢â¬â di Cinta Bangsat  https://www.facebook.com/permalink.php?story_fbid=603066366702547&id=100009975668705ÃÂ Ã¢â¬Â¦,,,,";0;1;0;0;0;0;0;0;0;0;0;0;fuck you but fuck i miss you arm februari di cinta bangsat ;1;1;0;0;0;0;0;0;1;0;0;0
2991;USER Anti Jokowi bagi Bani Kampret itu udah jadi Rukun Iman mereka kali ye Bang... \xf0\x9f\x98\x82\xf0\x9f\x98\x82\xf0\x9f\x98\x82\xf0\x9f\x98\x82\xf0\x9f\x98\x82';1;1;0;1;0;0;0;0;1;0;1;0;user anti jokowi bagi bani kampret itu sudah jadi rukun iman mereka kali iya bang ;1;1;0;0;0;0;0;0;1;0;1;0
2993;I don't wanna give you fuck jungkook, why your voice look so hot, bangsat emang jungkook,,,,;0;1;0;0;0;0;0;0;0;0;0;0;i do not ingin give you fuck jungkook kenapa your suara look so hot bangsat memang jungkook ;1;1;0;0;0;0;0;0;1;0;0;0
2994;"Orang yg suka merusak generasi muda adalah manusia ateis atau komunis.; #2019GantiPresiden";0;0;0;0;0;0;0;0;0;0;0;0;orang  suka merusak generasi muda adalah manusia ateis atau komunis ganti presiden;1;0;0;0;0;0;0;0;1;0;0;0
2995;"Then the very next minute they're the one shouting,
""Darah kafir halal! Cina kafir! Gantung! Bunuh!""

Hypocrites at its best.";1;1;0;1;1;1;0;0;0;0;0;1;then the sangat next minute they are the one shouting darah kafir halal cina kafir gantung bunuh hypocrites at it is best ;0;1;0;0;0;0;0;0;0;0;0;0
2996;"USER USER taman rezim skrg di 2019; rakyat sudah muak; #2019GantiPresiden";1;0;0;1;0;0;0;0;1;0;1;0;user user taman rezim sekarang di rakyat sudah muak ganti presiden;1;0;1;0;0;0;0;0;1;1;0;0
2998;Wow..gerakan #2019GantiPresiden MENDUNIA...spanduk beredar d Turki ,Jepang,Jerman,Inggris..;0;0;0;0;0;0;0;0;0;0;0;0; gerakan ganti presiden mendunia spanduk beredar di turki jepang jerman inggris ;1;0;0;0;0;0;0;0;1;0;0;0
3002;USER USER USER USER USER USER USER USER USER USER USER USER USER Daripada kau Bodat KOMUNIS TOLOL';1;1;1;0;0;1;0;0;0;1;0;0;user user user user user user user user user user user user user daripada kamu monyet komunis tolol ;1;1;1;0;0;0;0;0;1;1;0;0
3004;batalkan pelantikan anies, angkat soemarsono jd PLT gubernur cc USER;1;0;1;0;0;0;0;0;1;1;0;0;batalkan pelantikan anies angkat soemarsono jadi plt gubernur cc user;0;0;0;0;0;0;0;0;1;0;0;0
3006;USER USER Cina cuma jadi benalu nkri \xf0\x9f\x90\xb7\xf0\x9f\x90\xb7\xf0\x9f\x90\xb7';1;1;0;1;0;1;0;0;0;0;1;0;user user cina hanya jadi benalu negara kesatuan republik indonesia ;1;0;0;1;0;1;0;0;0;0;0;1
3008;"Jadi ingat...sama yang gak nemui rakyatnya....; #2019GantiPresiden;";1;0;1;0;0;0;0;0;1;1;0;0;jadi ingat sama  tidak menemui rakyatnya ganti presiden ;1;0;0;0;0;0;0;0;1;0;0;0
