Index;Tweet;HS;Abusive;HS_Individual;HS_Group;HS_Religion;HS_Race;HS_Physical;HS_Gender;HS_Other;HS_Weak;HS_Moderate;HS_Strong;Tweet_Parsed;HS_predict;Abusive_predict;HS_Individual_predict;HS_Group_predict;HS_Religion_predict;HS_Race_predict;HS_Physical_predict;HS_Gender_predict;HS_Other_predict;HS_Weak_predict;HS_Moderate_predict;HS_Strong_predict
1691;"RT USER: Assalamu'alaykum ,Met Pagi Sobat , Satukan Suara Utk Ganti Rezim Ganti Presiden Melalui PILKADA 27Juni 2018 &amp; PILPRES 2019 ; Pilih Paslon Usungan Dr Partai"" Idealis Bermartabat ; ; #EraMas Utk SUMUT1; #MbangunJatengMuktiBareng Utk J";0;0;0;0;0;0;0;0;0;0;0;0;rt user asalamualaikum alaykum selamat pagi sobat satukan suara untuk ganti rezim ganti presiden melalui pilihan kepala daerah juni pemilihan presiden pilih pasangan calon usungan dari partai idealis bermartabat keramas untuk sumatera utara mbangun jateng mukti bareng untuk j;1;0;0;0;0;0;0;0;1;0;0;0
1692;if you can't respect, don't even open your mouth, kontol.;1;1;1;0;0;0;0;0;1;1;0;0;if you can not respect do not even open your mouth kontol ;0;1;0;0;0;0;0;0;0;0;0;0
1694;I made them so they don't Stick too much out the side Lmaoo I guess sis wasn't with it https://twitter.com/chai_bae/status/1224191758025797632Â â¦;0;0;0;0;0;0;0;0;0;0;0;0;i made them so they do not stick too much out the side laughing my ass off i guess sister was not dengan it ;0;1;0;0;0;0;0;0;0;0;0;0
1696;Rama biasa bngt ngetweet sendiri bales sendiri, kampang.';1;1;1;0;0;0;0;0;1;1;0;0;rama biasa banget mentwit sendiri balas sendiri kampang ;0;1;0;0;0;0;0;0;0;0;0;0
1699;Yess.. Need to stop typing #PrabowoGila or #prabowohalu, perhaps we change into #prabowoinsane.. Asiyappppp PRESIDENT!;1;1;1;0;0;0;0;0;1;1;0;0;yes need to stop mengetik prabowo gila orang prabowo halu perhaps we change into prabowo insane siap presiden ;0;1;0;0;0;0;0;0;0;0;0;0
1702;USER Assalamualaikum..\nsiapa yg bela kresten penyembah bangke yesus busuk itu, ga ada satupun yg bela kresten yg bodoh itu.';1;1;0;1;1;0;0;0;0;0;1;0;user assalamualaikum siapa  bela kristen penyembah bangkai yesus busuk itu tidak ada satupun  bela kristen  bodoh itu ;0;1;0;0;0;0;0;0;0;0;0;0
1703;Setnov BEBAS. So BUAT apa msh mendukung USER . BUBARkan lalu BENTUK lembaga BARU yg lebih BERSIH. USER USER USER;1;0;0;1;0;0;0;0;1;0;0;1;setya novanto bebas so buat apa masih mendukung user bubarkan lalu bentuk lembaga baru  lebih bersih user user user;1;0;0;1;0;0;0;0;1;0;0;0
1705;USER USER Nape ente semakin jauh bud? Apa lidahmu sdh sangat tebal sampai menjilat spt itu?\n\nBELUM TERJADI, BARU AKAN dan itupun dibantu oleh 4 bank asing.\n\nKeluar mulut buaya masuk mulut singa.';1;0;1;0;0;0;0;0;1;1;0;0;user user kenapa kamu semakin jauh bud apa lidahmu sudah sangat tebal sampai menjilat seperti itu belum terjadi baru akan dan itupun dibantu oleh bank asing keluar mulut buaya masuk mulut singa ;0;0;0;0;0;0;0;0;0;0;0;0
1709;USER USER USER USER USER USER USER Klw ente atheis..ngapain sibuk dgn agama orang...;0;0;0;0;0;0;0;0;0;0;0;0;user user user user user user user kalau kamu ateis apa sibuk dengan agama orang ;1;0;0;0;0;0;0;0;0;0;0;0
1710;RT USER: Ustad tukang fitnah ini menuduh Jokowi PKI kapan ditangkap?;1;0;1;0;0;0;0;0;1;1;0;0;rt user ustad tukang fitnah ini menuduh jokowi partai komunis indonesia kapan ditangkap ;1;0;0;0;0;0;0;0;1;0;0;0
1714;Keciduk juga ni Kunyuk...\nProses hukum aja....kagak usah pake Matre... URL;1;1;1;0;0;0;0;0;1;1;0;0;terciduk juga nih kunyuk proses hukum saja tidak usah pakai matre url;1;1;0;0;0;0;0;0;0;0;0;0
1719;USER USER USER USER Ketahuan kan akhirnya...ngaku sendiri maksa org dipenjara.. Bajingan berkedok agama;1;1;1;0;1;0;0;0;0;1;0;0;user user user user ketahuan  akhirnya mengakui sendiri memaksa orang di penjara bajingan berkedok agama;1;1;1;0;0;0;0;0;0;0;0;0
1720;"yaudah atuh usir hindu budha juga aja biar gimana pun mereka nga monoteis. atau, tanyain aja dulu deh. tau arti kata ""esa"" nga sih?";1;0;0;1;1;0;0;0;0;0;0;1; sudah atuh usir hindu buddha juga saja biar bagaimana  mereka tidak monoteis atau tanyakan saja dulu  tau arti kata esa tidak  ;1;0;0;1;0;0;0;0;0;0;0;0
1722;bola itu buat dimainin di lapangan, bukan buat dimain-mainin di congor lu yang bapuk!';1;1;1;0;0;0;1;0;0;1;0;0;bola itu buat dimainkan di lapangan bukan buat dimainkan mainkan di congor kamu  bapuk ;1;1;0;0;0;0;0;0;0;0;0;0
1727;"Apparently  USER is a bigger PU$$Y than a stray cat.ð
#shameonyousaddiq
#shameonyoumalaysia

Okay then, maybe we stab one or two Malay b!tches and called it a hoax. How about that, Sad Dick?  https://twitter.com/permadiaktivis/status/1198045430572994560Â â¦";1;1;1;0;0;0;0;0;1;1;0;0;apparently user is a bigger punya iya tahan a menyimpang cat shame on you saddiq shame on you malaysia ok then maybe we stab one orang dua malaysia b tches and called it a hoaks how about that sad dick ;1;0;0;0;0;0;0;0;1;0;0;0
1731; USER I got called a Cina Kafir and that baik xyah vote;0;1;0;0;0;0;0;0;0;0;0;0; user i got called a cina kafir and that baik xyah memilih;1;1;0;0;0;0;0;0;0;0;0;0
1734;Hahahaha maybe should try that. I am lucky enough to live in Malay neighbourhood. Tak banyak anjing. Just bila pergi menumpang rumah orang, keluar malam2. Like byk. Hahaha;0;0;0;0;0;0;0;0;0;0;0;0; maybe should try that i am lucky enough to live in malaysia neighbourhood tidak banyak anjing just bila pergi menumpang rumah orang keluar malam like banyak ;0;1;0;0;0;0;0;0;0;0;0;0
1736;YOU GO GURLLL FUCK VITA JELLY DRINK BANGSAT,,,,;0;1;0;0;0;0;0;0;0;0;0;0;you go girl fuck vita jelly drink bangsat ;1;1;1;0;0;0;0;0;1;1;0;0
1738;USER hehe kampungan ya bah yg suka banding2in rezim :)))';0;0;0;0;0;0;0;0;0;0;0;0;user  kampungan  bah  suka membanding bandingkan rezim ;0;1;0;0;0;0;0;0;0;0;0;0
1745;USER USER USER Musibah atau berkah DKI punya pimpinan koplak kuadrat ky gini.....tereak2 pribumi....anti aseng.....ujungnya ke aseng lagi aseng lg....pemujanya pd diem krn udh dpt kaplingan surga.....yg ga dukung dia makin hari mkin e;1;0;1;0;0;0;0;0;1;1;0;0;user user user musibah atau berkah daerah khusus ibukota punya pimpinan kocak kuadrat seperti begini teriak teriak pribumi anti asing ujungnya ke asing lagi asing lagi pemujanya pada diam karena sudah dapat kaveling surga  tidak dukung dia semakin hari semakin e;0;0;0;0;0;0;0;0;0;0;0;0
1746;The people has dicide no more chance for a liar #2019GantiPresiden;1;0;1;0;0;0;0;0;1;1;0;0;the people has dicide no more chance for a liar ganti presiden;1;0;0;0;0;0;0;0;1;0;0;0
1747;"OpRohingya kristen bunuh muslim di afghanistan yahudi bunuh muslim di palestina. Didunia muslim disebut ""teroris""";1;0;0;1;1;0;0;0;0;0;1;0;op rohingya kristen bunuh muslim di afghanistan yahudi bunuh muslim di palestina di dunia muslim disebut teroris;1;0;0;1;0;0;0;0;0;0;0;0
1749;sekenario besar lagi di siapkan untuk melemahkan/membinasakan kpk.kalau tdk berhasil imbasny lengserkan jokowi ganti pemimpin pro korupsi;1;0;1;0;0;0;0;0;1;1;0;0;skenario besar lagi di siapkan untuk melemahkan membinasakan komisi pemberantasan korupsi kalau tidak berhasil imbasnya lengserkan jokowi ganti pemimpin pro korupsi;1;0;1;1;0;0;0;0;1;0;0;0
1751;Akui saja Ahok dan Djarot kalian gagal atasi banjir.Orang kena banjir anda sibuk sidang kasus penista agama;1;0;1;0;0;0;0;0;1;1;0;0;mengakui saja ahok dan djarot kalian gagal atasi banjir orang kena banjir kamu sibuk sidang kasus penista agama;1;0;1;0;0;0;0;0;0;0;0;0
1754;#Indonesia enacts ban on #RadicalIslamic group #HTI ;1;0;0;1;1;0;0;0;0;0;1;0; indonesia enacts ban on radical islamic grup hizbut tahrir indonesia ;0;0;0;1;1;0;0;0;0;0;0;0
1757;Secara objektif harus diakui peluang Anies jadi Presiden 2019-2024 lebih besar dibanding jadi wapres jika duet dgn Prabowo\n\nKita akui Prabowo lemah dalam mengamankan diri dari serangan fitnah, penyusupan, penggembosan dan pengkhianatan\n\nPrabowo juga;1;0;1;0;0;0;0;0;1;1;0;0;secara objektif harus diakui peluang anies jadi presiden lebih besar dibanding jadi wakil presiden jika duet dengan prabowo kita mengakui prabowo lemah dalam mengamankan diri dari serangan fitnah penyusupan penggembosan dan pengkhianatan prabowo juga;0;0;0;0;0;0;0;0;0;0;0;0
1760;#International joke of the week! Mr. Subianto has declared himself as the #IndonesiaElection winner despite all reputable pollsters show he is a loser. Prabowo has been reportedly diagnosed with mental illness, but he was still allowed to run for office anyway. I'm kinda LOL! ð¤£;0;0;0;0;0;0;0;0;0;0;0;0; international joke of the week mr subianto has declared himself as the indonesia election winner despite all reputable pollsters show he is a loser prabowo has been reportedly diagnosed dengan mental illness but he was still allowed to run for office anyway i sama kinda  ;1;0;0;0;0;0;0;0;0;0;0;0
1762;USER USER USER USER USER USER USER USER USER USER USER Yg gak pake jilbab komunis? Megawati, sri mulyani, puan maharani lo sebut apa?\n\nMo ngetwit pinter dl ya tong...';1;0;1;0;0;0;0;0;1;1;0;0;user user user user user user user user user user user  tidak pakai jilbab komunis megawati sri mulyani puan maharani kamu sebut apa mau mentwit pintar dulu  tong ;1;0;1;0;0;0;0;0;0;1;0;0
1763;USER Mana suaranya cebong.... ??????? \nKeluar kolam dunk...dunk...dunk \xf0\x9f\x98\x81\xf0\x9f\x98\x81\xf0\x9f\x98\x81';1;1;1;0;0;0;0;0;1;1;0;0;user mana suaranya kecebong keluar kolam    ;1;1;0;0;0;0;0;0;1;0;0;0
1764;when your teacher is a 'sumbu pendek', tell us about how cruel america is and jewish, fck ð;1;1;1;0;0;0;0;0;1;1;0;0;when your teacher is a umbu pendek tell us about how cruel america is and jewish fuck ;0;1;0;0;0;0;0;0;0;0;0;0
1765;USER Demo lagi sana ke KPK, tp bawa pasukan nasi bungkus yg lebih banyak biar gak malu2in \xf0\x9f\x98\x82\xf0\x9f\x98\x82\xf0\x9f\x98\x82';0;0;0;0;0;0;0;0;0;0;0;0;user demo lagi sana ke komisi pemberantasan korupsi tetapi bawa pasukan nasi bungkus  lebih banyak biar tidak memalukan ;1;0;0;1;0;0;0;0;1;0;0;0
1769;USER Pak USER Mahfud MD sudah berpaling dari Allah SWT Pemberang, demi bangsa ajak semua Buang Islam;1;1;0;1;1;0;0;0;0;0;0;1;user pak user mahfud md sudah berpaling dari allah subhanahu wa taala pemberang demi bangsa ajak semua buang islam;1;0;0;1;1;0;0;0;0;0;1;0
1770;The world's largest Presidential election is underway in Indonesia, across 17 000 islands, with two hundred million ellegible voters. This is the world's most complicated single day election.  USER  USER  USER #IndonesiaElection;1;0;0;1;0;0;0;0;1;0;1;0;the world largest presidential election is underway in indonesia across islands dengan dua hundred million ellegible pemilih this is the world paling complicated single day election user user user indonesia election;0;0;0;0;0;0;0;0;0;0;0;0
1771;"??? buruk sekali perilaku anda, Djan Faridz sy tak kenal dan tak pernah ketemu selama pilpres. ; ; Sutiyoso sy tau dan sy dukung dulu jd Ka BIN. ; ; Anda ngawur dlm hal ini. Tolong ganti dulu ava mu, kasian Almarhum Lopa km pake wajahnya sementara km tukan";1;0;1;0;0;0;0;0;1;1;0;0; buruk sekali perilaku kamu bermain disc jockey fariz aku tidak kenal dan tidak pernah ketemu selama pemilihan presiden sutiyoso aku tau dan aku dukung dulu jadi kakak bin kamu ngawur dalam hal ini tolong ganti dulu ava mu kasihan almarhum lopa km pakai wajahnya sementara km itukan;0;0;0;0;0;0;0;0;0;0;0;0
1772;JANJI DPR!! BULLSHIT MY FRIEND!!!  USER;1;1;0;1;0;0;0;0;1;0;1;0;janji dewan perwakilan rakyat bullshit my friend user;1;1;0;1;0;0;0;0;1;0;0;0
1774;#catat!Terimakasih sudah menjadi orang idiot pertama dan terakhir yang membuka hatiku utk mengerti apa itu persahabatan';0;1;0;0;0;0;0;0;0;0;0;0; catat terima kasih sudah menjadi orang idiot pertama dan terakhir  membuka hatiku untuk mengerti apa itu persahabatan ;0;0;0;0;0;0;0;0;0;0;0;0
1776;"""I'm A Muslim, I Respect Sunnahh""
But You Are Doing The Things The Prophet Never Did.  

Okay o Sheikh Munafik";1;0;1;0;1;0;0;0;0;1;0;0;i sama a muslim i respect sunnahh but you are doing the berpikir the prophet never did ok o syekh munafik;0;0;0;0;0;0;0;0;0;0;0;0
1777;"Only stupid people who want to be fooled and impoverished still believe in political parties that are in power by destroying law, economics and democracy.
#JagaDanKawalAnies
Democracy in Indonesia decays & will die slowly. 
Cc.
 USER
 USER
 USER
 USER
 USER pic.twitter.com/bBSmQdswf4";1;1;0;1;0;0;0;0;1;0;1;0;only bodoh people who want to be fooled and impoverished still believe in politik parties that are in power by destroying law ekonomi and democracy jaga dan kawal anies democracy in indonesia decays will dia slowly cc user user user user user ;0;0;0;0;0;0;0;0;0;0;0;0
1780;That man is rude as fuck! Bangsat luuu,,,,;1;1;1;0;0;0;0;0;1;1;0;0;that man is rude as fuck bangsat kamu ;0;1;0;0;0;0;0;0;0;0;0;0
1781;USER Itu mantan penyanyi cilik yang gembrot n jelek banget itu ya klu tidak salah eh ternyata gedenya jadi cebong juga kasian deh kamu bakalan kagak ada yang milih calon SJ sombong jelas orang kagak pernah sujud ! TENGGELAMKAN';1;1;1;0;0;0;1;0;0;0;0;1;user itu mantan penyanyi kecil  gembrot dan jelek banget itu  klu tidak salah  ternyata gedenya jadi kecebong juga kasihan  kamu akan tidak ada  memilih calon saja sombong jelas orang tidak pernah sujud tenggelamkan ;1;1;0;0;0;0;0;0;1;0;0;0
1782;"USER USER USER USER USER wuih.. paham betul Jawa Timur..; kok ndak jadi penasehat gubernur toh mas.. kok malah mburuh pabrik..; eman2 potensimu mas..#eh";1;0;1;0;0;0;0;0;1;1;0;0;user user user user user  paham benar jawa timur  tidak jadi penasehat gubernur  mas  malah buruh pabrik sayang potensimu mas ;0;0;0;0;0;0;0;0;0;0;0;0
1783;USER USER USER USER USER USER USER USER Bgni sj mslh TKA ilegal asal china semua sdh jelas n faktual mau bukti aplgie n sdh dbhas URL ini jelas pmrintah g brniat slesaikan..;1;0;1;0;0;0;0;0;1;1;0;0;user user user user user user user user begini saja masalah tenaga kerja asing ilegal asal cina semua sudah jelas dan faktual mau bukti apa lagi dan sudah dibahas url ini jelas pemerintah tidak berniat selesaikan ;0;0;0;0;0;0;0;0;0;0;0;0
1790;Semoga Panglima TNI bisa menyelamatkan NKRI dari para penjual aset negara dan dari antek-antek komunis;1;0;0;1;0;1;0;0;0;0;1;0;semoga panglima tentara nasional indonesia bisa menyelamatkan negara kesatuan republik indonesia dari para penjual aset negara dan dari antek antek komunis;1;0;0;1;0;0;0;0;0;0;0;0
1791;USER USER Lu gak bakal tau juga susih, actress china namanya Mingmukedaisi Kuerban. Bingung kan lu wkwk';0;0;0;0;0;0;0;0;0;0;0;0;user user kamu tidak bakal tau juga susah actress cina namanya mingmukedaisi kurban bingung  kamu  ;1;1;1;0;0;0;0;0;0;1;0;0
1795;Gak usah ngomong lah Joko. Beras saja import. URL;1;0;1;0;0;0;0;0;1;1;0;0;tidak usah bicara  joko beras saja impor url;1;0;1;0;0;0;0;0;0;1;0;0
1800;"Share your country's experience.
#WorkpointSHORTs >>  https://www.facebook.com/WorkpointNews/videos/499905020378781Â â¦ â¦
#ASEAN  USER #ShameOnYouMalaysia #SEAGames2017 #Malaysia ðð pic.twitter.com/J9Ik1fVbb0";0;0;0;0;0;0;0;0;0;0;0;0;bagikan your country experience work point shorts asean user shame on you malaysia sea games malaysia ;1;0;0;0;0;0;0;0;0;0;0;0
1801;USER Tai kucing, cina mulai intervensi wilayah kalimantan, hati Hati gara gara ahok simulut jamban';1;1;0;1;0;1;0;0;0;0;1;0;user tai kucing cina mulai intervensi wilayah kalimantan hati hati gara gara ahok si mulut jamban ;1;1;0;0;0;0;0;0;0;0;0;0
1802;RT USER: USER Oh ternyata kesibukan bertambah promosi hoax\nKampret laah\nIni nomor 0856 bisa di daftar ke USER ga\nBiar ga p\xe2\x80\xa6';1;1;0;1;0;0;0;0;1;0;1;0;rt user user  ternyata kesibukan bertambah promosi hoaks kampret  ini nomor bisa di daftar ke user tidak biar tidak p ;1;1;0;0;0;0;0;0;1;0;0;0
1805;RT USER USER Karna mreka yakin bila melawan lg PS akan kmbali kalah lawan JKW.;1;0;1;0;0;0;0;0;1;1;0;0;rt user user karena mereka yakin bila melawan lagi play station akan kembali kalah lawan jokowi ;1;0;1;0;0;0;0;0;1;0;0;0
1806;USER Kacau ini era. Kacau lagi yg sdh pd tau tapi diam krna sdh kontrak jadi jongos asing aseng. #Naked';1;1;0;1;0;0;0;0;1;0;1;0;user kacau ini era kacau lagi  sudah pada tau tapi diam karena sudah kontrak jadi jongos asing asing naked ;1;0;0;0;0;0;0;0;0;0;0;0
1812;USER Hmmmm somi mencium bau bau bangkai :(';0;0;0;0;0;0;0;0;0;0;0;0;user  somi mencium bau bau bangkai ;0;1;0;0;0;0;0;0;0;0;0;0
1813;USER USER USER USER USER USER USER USER USER USER USER Biasa.. bani coli, ngga beda jauh sm junjungan dan kawan2nya.. haha';1;1;0;1;0;0;0;1;0;0;1;0;user user user user user user user user user user user biasa bani coli tidak beda jauh sama junjungan dan kawan kawannya  ;1;0;0;1;0;0;0;0;0;0;1;0
1824;Berbanding lurus dengan kebijakan rezim ini bermesraan dg cina produsen terbesar narkotika yg masuk ke Indonesia URL;1;0;0;1;0;1;0;0;0;0;1;0;berbanding lurus dengan kebijakan rezim ini bermesraan dengan cina produsen terbesar narkotika  masuk ke indonesia url;1;0;0;1;0;0;0;0;0;0;1;0
1826;Woohoo, lumayan juga ternyata wifi di rumah nih~ \npenolong saat kuota habis sebekum waktunya.. kampret nih tri~ \xf0\x9f\x98\xaa URL;1;1;0;1;0;0;0;0;1;0;1;0; lumayan juga ternyata wifi di rumah nih penolong saat kuota habis sebelum waktunya kampret nih tri url;1;1;0;0;0;0;0;0;0;0;0;0
1827;USER diem setan';1;1;1;0;0;0;0;0;1;1;0;0;user diam setan ;0;1;0;0;0;0;0;0;1;0;0;0
1833;"USER USER USER Ga usah sok ngomong ekonomi dah; Kl bos kalian aja masih nunggak gaji karyawan, buat ngangkut kader ketempat acara ga mampu bayar carteran angkot, si USER bayar listrik pun nunggak; Beresin dulu ekonomi kalian; Ekonom";0;0;0;0;0;0;0;0;0;0;0;0;user user user tidak usah sok bicara ekonomi sudah kalau bos kalian saja masih menunggak gaji karyawan buat mengangkut kader ke tempat acara tidak mampu bayar carteran angkutan kota  user bayar listrik  menunggak bereskan dulu ekonomi kalian ekonom;1;0;0;0;0;0;0;0;0;0;0;0
1834;USER Yg salah cuma kaum cebong...lah situ kaum cebong bukan';1;1;1;0;0;0;0;0;1;1;0;0;user  salah hanya kaum kecebong  kamu kaum kecebong bukan ;1;1;0;1;0;0;0;0;1;0;0;0
1835;Diem-diem bae, Rupiah makin nyungsep atas dolar. sudah tembus Rp. 14.441 aja. Sebenernya gua malah seneng kalo langsung tembus 16 ribu. biar cepet lengser ni rezim kodok!';1;1;1;0;0;0;0;0;1;1;0;0;diam diam saja rupiah semakin nyungsep atas dolar sudah tembus rupiah saja sebenarnya aku malah senang kalau langsung tembus ribu biar cepat lengser nih rezim kodok ;0;0;0;0;0;0;0;0;0;0;0;0
1838;USER USER Bbb for bukan bangsad biasa';0;1;0;0;0;0;0;0;0;0;0;0;user user bbb for bukan bangsat biasa ;1;1;1;0;0;0;0;0;1;1;0;0
1839;Kau tahu kenapa kebanyakan orang menganggap kecantikan seorang wanita lebih penting di banding perangai yang baik? Karena di dunia ini, lelaki bodoh lebih banyak jumlahnya di banding lelaki buta. *nasihat orang tua dulu';0;0;0;0;0;0;0;0;0;0;0;0;kamu tahu kenapa kebanyakan orang menganggap kecantikan seorang wanita lebih penting di banding perangai  baik karena di dunia ini lelaki bodoh lebih banyak jumlahnya di banding lelaki buta nasehat orang tua dulu ;0;1;0;0;0;0;0;0;0;0;0;0
1842;As one of Muslim majority country in the world, we never abuse minority instead we did give them the same rights! This current regime extremely corrupts and backing up by his supporters. #TheGreatCampaignOfPrabowo #2019GantiPresiden;1;0;0;1;0;0;0;0;1;0;1;0;as one of muslim mayoritas country in the world we never abuse minoritas instead we did give them the sama rights this current regime extremely corrupts and backing up by his supporters the great campaign of prabowo ganti presiden;0;0;0;0;0;0;0;0;0;0;0;0
1843;Jokowi harus segera di lengserkan dan di ganti oleh Ahmad Heryawan. Cebong jgn nyolot, saya Hanya Beri Contoh lo;1;1;1;0;0;0;0;0;1;0;0;1;jokowi harus segera di lengserkan dan di ganti oleh ahmad heryawan kecebong jangan solot saya cuma beri contoh kamu;1;1;1;0;0;0;0;0;1;0;0;0
1845;USER USER USER Ditanya siapa gantinya presiden, celeng lansung klojota\nGak salah rockygering bilang celeng dungu stabil.';1;1;0;1;0;0;0;0;1;0;1;0;user user user ditanya siapa gantinya presiden celeng langsung kelojotan tidak salah rocky gerung bilang celeng dungu stabil ;1;1;1;0;0;0;0;0;1;1;0;0
1846;USER USER USER Ga sembuh sembuh dungu nya mereka Kanda USER \xf0\x9f\x98\x82\xf0\x9f\x98\x82\xf0\x9f\x98\x82\xf0\x9f\x98\x82\xf0\x9f\x98\x82';1;1;0;1;0;0;0;0;1;0;1;0;user user user tidak sembuh sembuh dungu  mereka kanda user ;1;1;0;0;0;0;0;0;1;0;0;0
1849;USER USER USER Wajah anak lo Kliatan Bgt ya!! Penuh dendam dan kebencian! Pasti anak anak lo makan dari hasil uang haram. Bapaknya kayak lo!! Banci dan rumpi!!! Lo ngatain gue makan tai?? Nah lo dan istri serta anak anak dan ortu lo makan bangke uang haram;1;1;0;1;0;0;0;1;0;0;1;0;user user user wajah anak kamu kelihatan banget  penuh dendam dan kebencian pasti anak anak kamu makan dari hasil duit haram bapaknya kayak kamu banci dan rumpi kamu memaki aku makan tai  kamu dan istri serta anak anak dan orang tua kamu makan bangkai duit haram;1;1;0;0;0;0;0;0;0;0;0;0
1854;USER Mana aku tahu, aku kan cebong..';0;0;0;0;0;0;0;0;0;0;0;0;user mana aku tahu aku  kecebong ;1;1;0;0;0;0;0;0;1;0;0;0
1856;USER WKWKWKWKWKKWKWKW GEBLEK BGT';1;1;1;0;0;0;0;0;1;1;0;0;user  geblek banget ;0;1;0;0;0;0;0;0;0;0;0;0
1857;USER Si BEJAT CABUL yg KRIMINAL ngoceh kriminalisasi ulama.\nDasar munafik';1;1;1;0;0;0;0;1;0;1;0;0;user  bejat cabul  kriminal mengoceh kriminalisasi ulama dasar munafik ;1;1;1;0;0;0;0;0;0;1;0;0
1865;Mr. President  USER please don't show us another bullshit.;1;1;1;0;0;0;0;0;1;1;0;0;mr presiden user please do not show us another bullshit ;1;1;0;0;0;0;0;0;1;0;0;0
1867;Don't have kampungan face la, but you look so much like that kid. Did you got any kecebong?;1;0;1;0;0;0;1;0;0;1;0;0;do not have kampungan face  but you look so much like that kid did you got any kecebong ;1;1;0;0;0;0;0;0;1;0;0;0
1872;Ok kalo bgt kita usir minoritas umat budha di indonesia kita barter sama umat Islam nya. USER USER USER USER;1;0;0;1;1;0;0;0;0;0;0;1;oke kalau banget kita usir minoritas umat buddha di indonesia kita barter sama umat islam  user user user user;1;0;0;1;1;0;0;0;0;0;0;0
1873;RT USER Usir aja duta besarnya Negara yg Kristen aja udah putus hubungan diplomatik.;1;0;1;0;1;0;0;0;0;0;0;1;rt user usir saja duta besarnya negara  kristen saja sudah putus hubungan diplomatik ;1;0;0;1;0;0;0;0;0;0;0;0
1879;USER Ayo mana si tua bangke dan pendukung kampretnya...';1;1;0;1;0;0;0;0;1;0;1;0;user ayo mana  tua bangkai dan pendukung kampretnya ;1;0;0;1;0;0;0;0;0;0;1;0
1881;""" USER: Quote tweet then maki orang ? hackers ? what the fuck *tenetnetnettenet*"" bangsat,,,,";0;1;0;0;0;0;0;0;0;0;0;0; user kutipan twit then maki orang hackers apa the fuck  bangsat ;1;1;0;0;0;0;0;0;1;0;0;0
1882;FUCK YOU  ISRAIL...YAHUDI...BANGSAT  http://fb.me/1hpG2Ofz8Â ;1;1;0;1;1;0;0;0;0;0;1;0;fuck you izrail yahudi bangsat ;1;1;0;0;1;0;0;0;0;0;0;0
1883;USER USER Gerombolan pks masih bisa booking pecun di hotel travel, fashion hotel dan area sekitar gunung sahari plus mabes dan sekitarnya. Aleksis mah cuma tumbal buat pencitraan sisanya di amankan sama wan abud';0;1;0;0;0;0;0;0;0;0;0;0;user user gerombolan partai keadilan sejahtera masih bisa booking pecun di hotel travel fashion hotel dan area sekitar gunung sahari plus markas besar dan sekitarnya alexis  hanya tumbal buat pencitraan sisanya di amankan sama wan abud ;1;0;0;0;0;0;0;0;1;0;0;0
1884;Lbh percaya perusahaan asing drpd media lokal.. Dasar antek asing ente Om USER..;1;0;1;0;0;0;0;0;1;1;0;0;lebih percaya perusahaan asing daripada media lokal dasar antek asing kamu om user ;1;0;1;0;0;0;0;0;0;1;0;0
1885;USER USER ASTAGA BOLOT BANGET DIA';1;1;1;0;0;0;1;0;0;1;0;0;user user astaga bolot banget dia ;0;1;0;0;0;0;0;0;0;0;0;0
1887;USER Najis not wkwk';0;1;0;0;0;0;0;0;0;0;0;0;user najis not  ;1;1;0;0;0;0;0;0;1;0;0;0
1890;Persetan dengan bocah kntl yg so kerad kecewa sekolah ganti nama \xf0\x9f\x98\x92\xf0\x9f\x98\x92 so pemes lu tong,biar apa coba.\n\nSekola lu kerjaannya cuma Pacaran,tidur sama jajan aja so so an bilang harga diri \xf0\x9f\x98\x92';1;1;1;0;0;0;0;1;0;1;0;0;persetan dengan bocah kontol  so kerad kecewa sekolah ganti nama so pemes kamu tong biar apa coba sekolah kamu kerjaannya hanya pacaran tidur sama jajan saja so so an bilang harga diri ;1;1;0;0;0;0;0;0;0;0;0;0
1892;next time pls understand the tweet before you say ngentat ngentot to others okay. it makes you looks so gross and uneducated. jan jadi sumbu pendek pls mba. jan gampang tersulut esmosi :) sekian dan terima cash;1;1;1;0;0;0;0;0;1;1;0;0;next time tolong understand the twit sebelum you say ngentot ngentot to others ok it makes you looks so gross and uneducated jangan jadi sumbu pendek tolong mbak jangan mudah tersulut emosi sekian dan terima cash;0;1;0;0;0;0;0;0;0;0;0;0
1893;Umpire pretended not report foul to MAS charging foul!!! Shit!!! #Football #SEAGames2017 #ShameOnYouMalaysia  https://twitter.com/_SKCS_/status/902517365123854336Â â¦;0;1;0;0;0;0;0;0;0;0;0;0;umpire pretended not laporan foul to mas charging foul shit football sea games shame on you malaysia ;0;0;0;0;0;0;0;0;0;0;0;0
1898;USER USER \xf0\x9f\x98\x82\xf0\x9f\x98\x82\xf0\x9f\x98\x82 Bilangnya anti ASING, ASENG, ASONG dan KOFAR, KAFIR, KAMPRETTTT.Ternyata manusia MUNA... semua kalian,USER doyan juga rupanya sama ASENG sampe import bawang puti;1;1;0;1;0;0;0;0;1;0;1;0;user user bilangnya anti asing asing asong dan kafir kafir kampret ternyata manusia munafik semua kalian user suka juga rupanya sama asing sampai impor bawang puti;1;1;0;0;0;0;0;0;0;0;0;0
1900;I fully respect those who admit that #PrabowoGila;1;1;0;1;0;0;0;0;1;0;1;0;i fully respect those who admit that prabowo gila;0;1;0;0;0;0;0;0;0;0;0;0
