Index;Tweet;HS;Abusive;HS_Individual;HS_Group;HS_Religion;HS_Race;HS_Physical;HS_Gender;HS_Other;HS_Weak;HS_Moderate;HS_Strong;Tweet_Parsed;HS_predict;Abusive_predict;HS_Individual_predict;HS_Group_predict;HS_Religion_predict;HS_Race_predict;HS_Physical_predict;HS_Gender_predict;HS_Other_predict;HS_Weak_predict;HS_Moderate_predict;HS_Strong_predict
807;Jgn ada yg percaya dgn akun ini\n\n\xe2\x9e\xa1 USER \n\xe2\x9e\xa1 WA 081381413774\n\nAwal nya dia ga percaya sy buat\nCAMSEX, trus sy buktikan Vc beberapa detik, pas suruh Tf alesan nya neko2\n\n\xe2\xac\x87Ni muka nya kaya monyet \xe2\xac\x87 URL;1;1;1;0;0;0;1;0;0;1;0;0;jangan ada  percaya dengan akun ini user wa awal  dia tidak percaya aku buat camsex terus aku buktikan video call beberapa detik pas suruh transfer alasan  banyak mau nih muka  kaya monyet url;0;0;0;0;0;0;0;0;0;0;0;0
810;USER Pak USER penyesatan yg dilakukan PBNU tampaknya demi kebaikan padahal menyembunyikan JAHAT Islam;1;1;0;1;1;0;0;0;0;0;1;0;user pak user penyesatan  dilakukan pengurus besar nahdlatul ulama tampaknya demi kebaikan padahal menyembunyikan jahat islam;1;0;0;0;1;0;0;0;0;0;0;0
811;USER USER USER USER USER USER USER USER USER USER USER USER USER USER USER USER Jadi kalo stereotif KAUM INTOLERAN, kalo punya resto, smntarany;0;0;0;0;0;0;0;0;0;0;0;0;user user user user user user user user user user user user user user user user jadi kalau stereotip kaum intoleran kalau punya resto sementaranya;1;0;0;1;0;0;0;0;1;0;0;0
813;#PDIPerjuanganMenang Mereka, kaum sipit mau menguasai tambang Indonesia, kalian ketawa saja. Dasar tidak punya nasionalisme Indonesia. Lebih baik tidak usah ikut Pemilu bagi kalian yang dukung 2 periode. Dan hasilnya Tambang Indonesia dikuasai sipit dan;1;1;0;1;0;1;0;0;0;0;1;0; partai demokrasi indonesia perjuangan menang mereka kaum sipit mau menguasai tambang indonesia kalian tertawa saja dasar tidak punya nasionalisme indonesia lebih baik tidak usah ikut pemilihan umum bagi kalian  dukung periode dan hasilnya tambang indonesia dikuasai sipit dan;0;0;0;0;0;0;0;0;0;0;0;0
814;"After he said ""itu orangnya aja yang bejat"" i said these to him and he replied this. Again, he stay with the ""sesuai syariat""  pic.twitter.com/v60XghQZqs";1;1;1;0;0;0;0;0;1;1;0;0;after he said itu orangnya saja  bejat i said these to him and he replied this again he stay dengan the sesuai syariat ;0;1;0;0;0;0;0;0;0;0;0;0
818;"PERNYATAAN RESMI KETUM FPI TENTANG ADE ARMANDO :; ; 1. Ade Armando sbg Seorang Akademisi telah sering melakukan perbuatan tidak pantas sekaligus jahat &amp; kotor, dari mulai Ujaran Kebencian &amp; Fitnah hingga Penodaan Agama &amp; Ulama.";1;0;1;0;0;0;0;0;1;1;0;0;pernyataan resmi ketua umum front pembela islam tentang adik armando adik armando sebagai seorang akademisi telah sering melakukan perbuatan tidak pantas sekaligus jahat kotor dari mulai ujaran kebencian fitnah hingga penodaan agama ulama ;0;0;0;0;0;0;0;0;0;0;0;0
819;"â USER: Israel has Setan. Palestine has Allah. Israelis can have this world, while Palestinians have Jannah #FreePalestine""â";1;0;0;1;0;0;0;0;1;0;1;0; user israel has setan palestina has allah israeli can have this world ketika palestinians have jannah free palestine ;1;1;0;1;0;0;0;0;1;0;1;0
821;"Ingat-ingat Jokower RT""USER: USER Nah disini tim sukses Ahok agak terlena mereka lebih mengedepankan hasil kinerja (rasio) ketimbang 2 aspek lain.""";1;0;0;1;0;0;0;0;1;0;1;0;ingat ingat jokower rtuser user  di sini tim sukses ahok agak terlena mereka lebih mengedepankan hasil kinerja rasio ketimbang aspek lain ;1;0;0;0;0;0;0;0;1;0;0;0
827;USER sitip itu apaan?';0;0;0;0;0;0;0;0;0;0;0;0;user sitip itu apaan ;1;1;1;0;0;0;0;0;0;1;0;0
828;USER KalauPRIBUMI iseng, aparat berwajah garang.... #Cina yang rasis, aparat jadi alay....';1;1;0;1;0;1;0;0;0;0;1;0;user kalau pribumi iseng aparat berwajah garang cina  racist aparat jadi alay ;1;0;0;1;0;0;0;0;0;0;1;0
835;"Bentar lagi saya mau kultwit menanggapi pandangan USER soal fiksi. ; ; Saya tak setuju RG dikriminalisasi. Lawanlah ide dgn ide! ; ; Bahwa kaum sumbu pendek tumben ga koar2 menghujat RG dgn alasan penodaan agama, ya disyukuri aja. Mgkn mrk mau bela";1;0;0;1;1;0;0;0;0;0;1;0;bentar lagi saya mau kuliah lewat twitter menanggapi pandangan user soal fiksi saya tidak setuju rg dikriminalisasi lawanlah ide dengan ide bahwa kaum sumbu pendek tumben tidak koar koar menghujat rg dengan alasan penodaan agama  disyukuri saja mungkin mereka mau bela;0;0;0;0;0;0;0;0;0;0;0;0
837;Lucinta luna is not stupid, s/he is another level of stupid. Megastupid.;1;1;1;0;0;0;0;0;1;1;0;0;lucinta luna is not bodoh si he is another level of bodoh mega stupid ;0;1;0;0;0;0;0;0;0;0;0;0
840;Ributkan ekonomi salah, Ributkan hukum salah, Ributkan otoriter salah, Ributkan patung salah. Trus kami bolehnya apa pak USER;1;0;1;0;0;0;0;0;1;1;0;0;ributkan ekonomi salah ributkan hukum salah ributkan otoriter salah ributkan patung salah terus kami bolehnya apa pak user;0;0;1;0;0;0;0;0;1;1;0;0
842;Oo yeahh.. Stop #PrabowoGila or #PrabowoHalu... It's so ashamed to our country having a mad crazy politician like #PrabowoGila;1;1;0;1;0;0;0;0;1;0;1;0;  stop prabowo gila orang prabowo halu it so ashamed to our country having a mad crazy politician like prabowo gila;0;1;0;0;0;0;0;0;0;0;0;0
843;USER iya anda d serang karena pandangan BEDA UNTUK BUBARKAN KPK BUKAN BENAHI KPK DAN SELAMATKAN KETUA ANDA DR KASUSNYA;1;0;1;0;0;0;0;0;1;1;0;0;user iya kamu di serang karena pandangan beda untuk bubarkan komisi pemberantasan korupsi bukan benahi komisi pemberantasan korupsi dan selamatkan ketua kamu dari kasusnya;1;0;0;1;0;0;0;0;1;0;0;1
846;Jiun gak salah pilih Taehyung (V bts ) sebagai idolanya dan tae beruntung banget punya fansboy sperti jiun \xf0\x9f\x92\x95\xf0\x9f\x92\x95 kesayangan ku \xf0\x9f\x98\x97\xf0\x9f\x98\x97';0;0;0;0;0;0;0;0;0;0;0;0;jiun tidak salah pilih taehyung v bts sebagai idolanya dan tai beruntung banget punya fans boy seperti jiun kesayangan aku ;0;1;0;0;0;0;0;0;0;0;0;0
847;USER Ada nenek2, beberapa monyet, anjing, kayak tuyul kepalanya kroak, ada kayak groot, ada kayak serigala, ada yang muka rata cuma ada matanya. Benarkah? Atau imajinasi saja';0;0;0;0;0;0;0;0;0;0;0;0;user ada nenek nenek beberapa monyet anjing kayak tuyul kepalanya berlubang ada kayak groot ada kayak serigala ada  muka rata hanya ada matanya benarkah atau imajinasi saja ;0;1;0;0;0;0;0;0;0;0;0;0
850;USER USER USER USER Hahahahahha....ga beda sama sanjungan mereka si babi jijik.....ehhh...bibib rijik...wkwkwkwk';1;1;1;0;0;0;0;0;1;1;0;0;user user user user  tidak beda sama sanjungan mereka  babi jijik  habib rizieq  ;0;1;0;0;0;0;0;0;0;0;0;0
851;USER USER USER USER USER USER USER USER edan ..edan... \npokoknya #2019GantiPresiden \ndan usir china china keparat gak tau malu';1;1;0;1;0;1;0;0;0;0;1;0;user user user user user user user user gila gila pokoknya ganti presiden dan usir cina cina keparat tidak tau malu ;1;0;1;0;0;1;0;0;0;0;0;0
853;Buat apa nyerang pemerintah Jokowi yg bentar lagi berhenti berkuasa?Lengserkan di pemilihan presiden mendatang.;1;0;1;0;0;0;0;0;1;0;0;1;buat apa menyerang pemerintah jokowi  bentar lagi berhenti berkuasa lengserkan di pemilihan presiden mendatang ;1;0;1;0;0;0;0;0;1;0;0;0
855;Bisa pak asal dpr tekan jokowi kalau jokowi menolak dpr bikin hak angket untuk turunkan jokowi;1;0;1;0;0;0;0;0;1;1;0;0;bisa pak asal dewan perwakilan rakyat tekan jokowi kalau jokowi menolak dewan perwakilan rakyat buat hak angket untuk turunkan jokowi;1;0;1;0;0;0;0;0;1;0;0;0
856;USER USER Ancem2an kaya banci aja jancok';1;1;1;0;0;0;0;1;0;1;0;0;user user ancam ancaman kaya banci saja jancuk ;0;1;0;0;0;0;0;0;0;0;0;0
858;Hajar ndan.. ganyang PKI URL;1;0;0;1;0;1;0;0;0;0;1;0;hajar dan ganyang partai komunis indonesia url;1;0;0;1;0;1;0;0;0;0;0;1
860;Para tokoh politik yang bersebrangan sama pemerintah smkin brani bicara kasar jauh dari etika si parabowo brani bilang elit goblog siapa yg dia maksud.anda sekolah dimana wo sampai kapan pun anda tdk akan jadi presiden.anggota dewan sudah brani bilang kementrian agama bangsat.';0;1;0;0;0;0;0;0;0;0;0;0;para tokoh politik  berseberangan sama pemerintah semakin berani bicara kasar jauh dari etika  prabowo berani bilang elite goblok siapa  dia maksud kamu sekolah dimana  sampai kapan  kamu tidak akan jadi presiden anggota dewan sudah berani bilang kementerian agama bangsat ;1;1;0;0;0;0;0;0;0;1;0;0
866;Mba ikutan yuk ke sgpore, vs thampines rovers, biar mbak ga di dalem mulu gitu gaul nya, mau ikut apa mau nge je dog aje mikirin the jak the jak yg kata nya kampungan :) // kalo mau ikut kabarin yaa, URL;1;1;0;1;0;0;0;0;1;0;1;0;mbak ikutan ayo ke singapura lawan tampines rovers biar mbak tidak di dalam mulu begitu gaul  mau ikut apa mau  saja dog saja memikirkan the jak the jak  kata  kampungan kalau mau ikut kabari  url;0;1;0;0;0;0;0;0;0;0;0;0
868;USER Minmin...\nPa gak ada bhn laen..\nItu bukan ungkapan ke indonesiaan\nTp ungkapan cocot dan otak yg pnh dengan napsu kekuasaan.....';1;1;1;0;0;0;0;0;1;1;0;0;user admin pak tidak ada bahan lain itu bukan ungkapan ke indonesia tetapi ungkapan cocot dan otak  pnh dengan nafsu kekuasaan ;1;0;0;0;0;0;0;0;1;0;0;0
870;"This is so low, I didn't expect this cheap from #ISPR.
They portrayed it like politicans are illiterate and Munafik. Shame!
#EhdEWafa pic.twitter.com/nS4IClk5X2";1;0;0;1;0;0;0;0;1;0;1;0;this is so low i did not expect this cheap from ispr they portrayed it like politicans are illiterate and munafik shame  ;0;0;0;0;0;0;0;0;0;0;0;0
871;Cuma bisa senyum liat kaum sumbu pendek... Too many stupid people making stupid people famous..;1;0;0;1;0;0;0;0;1;0;1;0;hanya bisa senyum lihat kaum sumbu pendek too many bodoh people making bodoh people famous ;1;1;0;1;0;0;0;0;1;0;1;0
873;#jokowiMUNDUR  SAVE OUR INDONESIA !!!!!;0;0;0;0;0;0;0;0;0;0;0;0; jokowi mundur save our indonesia ;1;0;0;0;0;0;0;0;1;0;0;0
874;USER Horeeee... Salah satu Cebong ada di paman sam... Apa kabar om';1;1;1;0;0;0;0;0;1;1;0;0;user horeeee salah satu kecebong ada di paman sama apa kabar om ;1;1;0;0;0;0;0;0;1;0;0;0
875;USER USER USER USER USER USER USER Alaaaahhhhh, omongan cebong mah udah ketauan kemana arahnya... Mau pakek tol kelok 1000 pun tetep... Ga usah sok2 Islam lu bong!!!';1;1;0;1;1;0;0;0;0;0;1;0;user user user user user user user  omongan kecebong  sudah ketahuan kemana arahnya mau pakai tol kelok  tetap tidak usah sok sok islam kamu kecebong ;1;1;1;0;0;0;0;0;1;1;0;0
877;USER USER masih noo;0;0;0;0;0;0;0;0;0;0;0;0;user user masih no;0;1;0;0;0;0;0;0;0;0;0;0
878;biksu cabul karena melanggar ajaran Budha ... MUSLIM JADI TERORIS KARENA SESUAI AJARAN ISLAM URL URL;1;1;0;1;1;0;0;0;0;0;1;0;biksu cabul karena melanggar ajaran buddha muslim jadi teroris karena sesuai ajaran islam url url;1;0;0;1;1;0;0;0;0;0;0;0
879;USER USER USER USER USER USER USER USER USER USER USER USER USER USER Ulama dr Importir Timur Tengah\nYg haus dengan kata Kopar Kafir Musyrik Bi'ah;1;1;1;0;1;0;0;0;0;1;0;0;user user user user user user user user user user user user user user ulama dari importir timur tengah  haus dengan kata kopar kafir musyrik bi ;0;0;0;0;0;0;0;0;0;0;0;0
881;USER USER USER USER USER USER USER USER USER USER USER USER Biasa itu....semua kerjaannya manusia2 pendengki,orangnya ya itu2 juga.sebagian besar pasukan nasi bung;0;0;0;0;0;0;0;0;0;0;0;0;user user user user user user user user user user user user biasa itu semua kerjaannya manusia manusia pendengki orangnya  itu itu juga sebagian besar pasukan nasi bung;0;1;0;0;0;0;0;0;0;0;0;0
882;Yes, why can't we be like Indonesia. Indonesia the panacea of Liberty and democracy. You filly sucker ð;1;1;1;0;0;0;0;0;1;1;0;0;iya kenapa can not we be like indonesia indonesia the panacea of liberty and democracy you filly sucker ;0;0;0;0;0;0;0;0;0;0;0;0
883;Ini anak aslinya geblek apa gimana ya? Tp likeable \xe2\x9d\xa4\xe2\x9d\xa4\xe2\x9d\xa4';1;1;1;0;0;0;0;0;1;1;0;0;ini anak aslinya geblek apa bagaimana  tetapi likeable ;1;1;0;0;0;0;0;0;1;0;0;0
884;penat bodo kena keep up ngan kepala kepala BANGSAT kat sana,,, sumpah mood takda babi? And that rude ass fucken probate just SHUT THE FUCK UP? IM FUCKING tired of your rude fucking 05 ass just SHUT !! THE !! FUCK !! UP !! bodo sial babi SAMPAH fuck you anak kutip babi,,,,;1;1;1;0;0;0;0;0;1;1;0;0;penat bodoh kena keep up gan kepala kepala bangsat kat sana sumpah mood tidak ada babi and that rude ass fuck probate just shut the fuck up i am fuck tired of your rude fuck ass just shut the fuck up bodoh sial babi sampah fuck you anak kutip babi ;0;1;0;0;0;0;0;0;0;0;0;0
885;Munafik kok teriak munafik ? Ngaca dulu sana.';1;1;1;0;0;0;0;0;1;1;0;0;munafik  teriak munafik mengaca dulu sana ;0;0;0;0;0;0;0;0;0;0;0;0
887;USER USER Cebong mana ngerti';1;1;1;0;0;0;0;0;1;1;0;0;user user kecebong mana mengerti ;1;1;0;1;0;0;0;0;1;0;1;0
888;USER Esdegan negaranya ada kedubes israel dan menjalin hub diplomatik, jokowi gak menjalin hub diplomat..\nEsdegan antek yahudi?';0;0;0;0;0;0;0;0;0;0;0;0;user es degan negaranya ada kedutaan besar israel dan menjalin hubung diplomatik jokowi tidak menjalin hubung diplomat es degan antek yahudi ;1;0;0;0;0;0;0;0;0;0;0;0
889;Look what you've done! More than 100 gold medals for country. I hope Malasian are proud of dirty triumph. #ShameOnYouMalaysia #SEAGAMES2017  https://twitter.com/iam_oil_/status/901814351014707202Â â¦;1;0;0;1;0;0;0;0;1;0;1;0;look apa you ve done more tahan gold medals for country i hope malaysian are proud of dirty triumph shame on you malaysia sea games ;1;0;0;0;0;0;0;0;1;0;0;0
890;Pengkhianatan PKI membunuh para Jendral PKI keblinger kata BungKarno.Bubarkan PKI Turunkan harga2 dan bubarkan kabinet Tritura.;1;0;0;1;0;1;0;0;0;0;0;1;pengkhianatan partai komunis indonesia membunuh para jenderal partai komunis indonesia keblinger kata bung karno bubarkan partai komunis indonesia turunkan harga harga dan bubarkan kabinet tritura ;1;0;0;1;0;0;0;0;0;0;0;1
892;USER USER USER USER USER si cebong sudah kebanyakan makan tahi jokowi, dia baru sadar kl nanti jokowi sudah mengumumkan INDONESIA dirubah menjadi INDOCHINA,,,';1;1;0;1;0;0;0;0;1;0;1;0;user user user user user  kecebong sudah kebanyakan makan tahi jokowi dia baru sadar kalau nanti jokowi sudah mengumumkan indonesia diubah menjadi indonesia china ;1;1;1;0;0;0;0;0;1;0;0;0
895;People make fun of Anies by saying âGabener' instead of âGubernur' ð¤£ which, I reckon you already know the meaning, translates to ânot right' or simply âwrong';0;0;0;0;0;0;0;0;0;0;0;0;people make fun of anies by saying tidak benar instead of gubernur which i reckon you already know the meaning translates to not right orang simply salah ;1;0;1;0;0;0;0;0;1;1;0;0
897;USER pantes bolot gini';1;1;1;0;0;0;1;0;0;1;0;0;user pantas bolot begini ;0;1;0;0;0;0;0;0;0;0;0;0
898;Jk Negeri ingin selamat, cm 1 Syarat.. lengserkan jokowi !!! Jaga NKRI Selamatkan Negeri Ini !!! .USER USER;1;0;1;0;0;0;0;0;1;0;0;1;kalau negeri ingin selamat cuma syarat lengserkan jokowi jaga negara kesatuan republik indonesia selamatkan negeri ini user user;1;0;1;0;0;0;0;0;1;0;0;0
899;USER USER USER Yg ngomong gitu siapa? Yg harus loe tanya itu knp gandeng 4 bank asing? Bukannya melakukan langkah hukum utk menggugat peraturan yg mengistimewakan Freeport?';0;0;0;0;0;0;0;0;0;0;0;0;user user user  bicara begitu siapa  harus kamu tanya itu kenapa gandeng bank asing bukannya melakukan langkah hukum untuk menggugat peraturan  mengistimewakan freeport ;1;0;0;0;0;0;0;0;0;0;0;0
901;brengsek itu orang terbuat dr apa bikin gue berkata kasar mulu';1;1;1;0;0;0;0;0;1;1;0;0;berengsek itu orang terbuat dari apa buat aku berkata kasar mulu ;0;1;0;0;0;0;0;0;0;0;0;0
902;USER USER najis bngt lo berdua kenapasi bully adek atip\xf0\x9f\x98\x9e';1;1;0;1;0;0;0;0;1;0;1;0;user user najis banget kamu berdua kenapa  bully adik atip ;1;1;0;0;0;0;0;0;0;0;0;0
903;USER kunyuk Asia...antek asing;1;1;1;0;0;0;0;0;1;1;0;0;user kunyuk asia antek asing;0;0;0;0;0;0;0;0;0;0;0;0
904;This is how  USER operate, he come face liar, not that support  USER but support truthful facts.;0;0;0;0;0;0;0;0;0;0;0;0;this is how user operate he come face liar not that support user but support truthful facts ;1;0;0;0;0;0;0;0;1;0;0;0
905;RT USER: Boleh minta maaf tapi proses hukum tetap harus jalan. Kunyuk satu ini harus dikasih pelajaran supaya kedepannya dia bi\xe2\x80\xa6';1;1;1;0;0;0;0;0;1;1;0;0;rt user boleh meminta maaf tapi proses hukum tetap harus jalan kunyuk satu ini harus dikasih pelajaran supaya kedepannya dia bi ;0;1;0;0;0;0;0;0;0;0;0;0
906;You may live happily on dunya but you'll be absolutely burn in akhira. Laknat Allah ke atas kamu Israel rejim zionis !;1;1;0;1;1;0;0;0;0;0;1;0;you mau live happily on dunia but you ll be absolutely burn in akhir laknat allah ke atas kamu israel rejim zionis ;1;1;0;1;0;0;0;0;1;0;1;0
907;USER USER Era-nya udah beda Boss. Dan ingatkah Anda, Ormas garda terdepan penumpas PKI???....... NU bos.. \xf0\x9f\x91\x8d\xf0\x9f\x99\x8f';0;0;0;0;0;0;0;0;0;0;0;0;user user era  sudah beda bos dan ingatkah kamu organisasi masyarakat garda terdepan penumpas partai komunis indonesia nu bos ;1;0;0;0;0;0;0;0;0;0;0;0
909;bodoh punya lalang bangsat fuck you. yeah you!,,,,;1;1;1;0;0;0;0;0;1;1;0;0;bodoh punya lalang bangsat fuck you  you ;1;1;0;0;0;0;0;0;1;1;0;0
913;i would rather watch porn than watching lucinta luna fckin fight sama artis lalalala sama2 gaje;1;1;1;0;0;0;0;0;1;1;0;0;i would rather watch porno tahan menonton lucinta luna fuck fight sama artis  sama sama tidak jelas;0;1;0;0;0;0;0;0;0;0;0;0
916;the shuttlecock was totally out but it was claimed In because #ShameOnYouMalaysia #worstSeagamesEver  USER pic.twitter.com/z1IUqJBkeA;1;0;0;1;0;0;0;0;1;0;1;0;the shuttlecock was totally out but it was claimed in because shame on you malaysia worst sea games ever user ;0;0;0;0;0;0;0;0;0;0;0;0
917;USER Wah kesempatan neh langsung deh dimanfaatin buat pencitraaan oleh rezim..\xf0\x9f\xa4\xa3\xf0\x9f\xa4\xa3';0;0;0;0;0;0;0;0;0;0;0;0;user  kesempatan nih langsung  dimanfaatkan buat pencitraan oleh rezim ;1;0;1;0;0;0;0;0;1;1;0;0
919;USER USER pekok kui abu tours asu taik taik kabeh... luwes asuuuu cino 35T bajingan taik asu maling sejati gawe indonesia rusak \xe2\x98\xba\xef\xb8\x8f';1;1;0;1;0;1;0;0;0;0;1;0;user user bodoh itu abu tours anjing tai tai semua luwes anjing cina tiga puluh lima triliun bajingan tai anjing maling sejati kerja indonesia rusak ;1;1;0;0;0;0;0;0;0;0;0;0
920;USER Aku melu KAFIR';0;0;0;0;0;0;0;0;0;0;0;0;user aku ikut kafir ;0;1;0;0;0;0;0;0;0;0;0;0
922;USER USER USER mau menasehati kali supaya ga ugal2an nih rezim.. eh tapi ini negeri sdh keburu ancor..nah skrg saja ekonomi morat marit,, kacaoooooo!!';1;0;1;0;0;0;0;0;1;1;0;0;user user user mau menasehati kali supaya tidak ugal ugalan nih rezim  tapi ini negeri sudah keburu hancur  sekarang saja ekonomi morat marit kacau ;1;0;0;0;0;0;0;0;0;0;0;0
926;fuck you gabener dan wagabener beserta teman2 bangsat lo.. my middle finger salute you all Ã°Å¸ââ¢,,,,;1;1;0;1;0;0;0;0;1;0;1;0;fuck you tidak benar dan  tidak benar beserta teman teman bangsat kamu my tengah finger salut you all ;0;1;0;0;0;0;0;0;0;0;0;0
932;Warga Moskow demo turunkan Jokowi di negara nya.. SaveUstadAlfian;1;0;1;0;0;0;0;0;1;1;0;0;warga moskow demo turunkan jokowi di negara  save ustaz alfian;1;0;1;0;0;0;0;0;1;0;0;1
935;"Why you always looking for a reason to pick a fight with us?
Wanna get yer ass whooped that much, huh?
#shameonyoumalaysia";1;1;1;0;0;0;0;0;1;1;0;0;kenapa you always looking for a reason to pick a fight dengan us ingin get yer ass whooped that much  shame on you malaysia;0;0;0;0;0;0;0;0;0;0;0;0
937;"Can't hold it back anymore..
#JokoWinElection #JokowiAminSudahMenang #PrabowoGila #savesandiagauno pic.twitter.com/C5K6kLI7Fx";0;1;0;0;0;0;0;0;0;0;0;0;can not hold it back anymore jokowi in election jokowi amin sudah menang prabowo gila save sandiaga uno ;1;1;1;0;0;0;0;0;1;0;0;0
938;USER Suruh mundur aja dari sekarang, daripada malu maluin. Kok ngarep didukung ulama.? Emang gak ada Parpol yang dukung.? Ndang bali o;0;0;0;0;0;0;0;0;0;0;0;0;user suruh mundur saja dari sekarang daripada malu memalukan  mengharap didukung ulama memang tidak ada partai politik  dukung segera bali o;1;0;1;0;0;0;0;0;1;1;0;0
943;RT  USER: Now SBY said Demokrat will appeal the #Pilkada decision. Serious bullshit. U don't deserve to appeal if you walk out.;1;1;1;0;0;0;0;0;1;1;0;0;rt user now susilo bambang yudhoyono said demokrat will appeal the pilihan kepala daerah decision serious bullshit kamu do not deserve to appeal if you walk out ;1;1;0;0;0;0;0;0;1;0;0;0
944;Bisa jadi Warga Negara di INDONESIA\nitu seharusnya ANDA\nBANGGA.\nini malah bilank Soekarno PKI. \xe2\x80\x94 benar-benar marah';0;0;0;0;0;0;0;0;0;0;0;0;bisa jadi warga negara di indonesia itu seharusnya kamu bangga ini malah bilang soekarno partai komunis indonesia benar benar marah ;1;0;0;0;0;0;0;0;0;0;0;0
945;"He's claimed to defend of Pancasila, but he's embraced HTI and FPI hahað
#LOL";1;0;1;0;1;0;0;0;0;1;0;0;he claimed to defend of pancasila but he embraced hizbut tahrir indonesia and front pembela islam  ;0;0;0;0;0;0;0;0;0;0;0;0
946;KY Tdk berfungsi makan gaji buta habisin APBN Hakim nakal merajalela BUBARKAN USER USER USER URL;1;0;0;1;0;0;0;0;1;0;0;1;seperti tidak berfungsi makan gaji buta habiskan apbn hakim nakal merajalela bubarkan user user user url;1;0;0;1;0;0;0;0;1;0;0;0
948;USER USER USER USER USER Goblok main2 lah kmall jngan dikolam terus..lo kata pakan ayam ga beli bong,itu semua import dan beli nya pakai kurs dollar..susah klo ngajak cebong debad soal dollar.';1;1;1;0;0;0;0;0;1;1;0;0;user user user user user goblok main main  ke mal jangan di kolam terus kamu kata pakan ayam tidak beli kecebong itu semua impor dan beli  pakai kurs dolar susah kalau mengajak kecebong debat soal dolar ;1;1;0;0;0;0;0;0;1;0;0;0
949;USER Cebong pemuja ahok pada meratap di thread ini \xf0\x9f\x98\x86\xf0\x9f\x98\x86\xf0\x9f\x98\x86';1;1;0;1;0;0;0;0;1;0;1;0;user kecebong pemuja ahok pada meratap di thread ini ;1;1;0;0;0;0;0;0;1;0;0;0
951;USER USER Kunyuk emang die wkwk';0;1;0;0;0;0;0;0;0;0;0;0;user user kunyuk memang dia  ;1;1;1;0;0;0;0;0;0;1;0;0
952;USER POTONG ONTA SEPULUH CUKUP TYDACK';0;0;0;0;0;0;0;0;0;0;0;0;user potong unta sepuluh cukup tidak ;0;1;0;0;0;0;0;0;0;0;0;0
954;USER muka muka pecun nih';1;1;1;0;0;0;1;1;0;1;0;0;user muka muka pecun nih ;0;1;1;0;0;0;0;1;0;1;0;0
955;"USER Mana situ ngasih("": itu cuma foto ya kutil onta'";1;1;1;0;0;0;0;0;1;1;0;0;user mana kamu memberi itu hanya foto  kutil unta ;1;1;1;0;0;0;0;0;0;1;0;0
962;HEH SINTING YA LU URL;1;1;1;0;0;0;1;0;0;1;0;0;he sinting  kamu url;0;1;0;0;0;0;0;0;0;0;0;0
963;USER 1. Bangsat\n2. Cebong\n3. Kecoak\n4. Bajingan\n5. Taik ayam\n6. Uanjing\n7. Bodat\n8. Cecurut\n9. Borax\n10. Kucirap';0;1;0;0;0;0;0;0;0;0;0;0;user bangsat kecebong kecoak bajingan tai ayam anjing monyet cecurut boraks kucirap ;1;1;0;0;0;0;0;0;1;0;0;0
964;Allah SWT tak paham toleransi hrs DIBUANG USER Ingin Belajar Toleransi & Keindonesiaan, Gabung SabangMerauke 2016;1;1;0;1;1;0;0;0;0;0;0;1;allah subhanahu wa taala tidak paham toleransi harus dibuang user ingin belajar toleransi keindonesiaan gabung sabang merauke ;1;0;0;1;1;0;0;0;0;0;1;0
965;Karna kondisi udah malem gw udah letih. Kalo capek mood juga gak keruan kan. Gw jadi merasa tertantang. Abangnya udah mayan jauh, mana kondisi jalan padet banyak mobil dan motor, tp entah setan mana yg bikin gw emosi, gw pun ngebut slusap slusup.';0;1;0;0;0;0;0;0;0;0;0;0;karena kondisi sudah malam aku sudah letih kalau lelah mood juga tidak keruan  aku jadi merasa tertantang abangnya sudah lumayan jauh mana kondisi jalan padat banyak mobil dan motor tetapi entah setan mana  buat aku emosi aku  ngebut sulap selusup ;0;0;0;0;0;0;0;0;0;0;0;0
972;Well mr  USER this one below is for you sir..this boy if urs  USER just made it worse.. #shameonyousaddiq #shameonyoumalaysia  https://twitter.com/permadiaktivis/status/1198045430572994560Â â¦ pic.twitter.com/mNunKX5Xig;1;0;1;0;0;0;0;0;1;1;0;0;well mr user this one below is for you sir this boy if urs user just made it worse shame on you saddiq shame on you malaysia ;1;0;0;0;0;0;0;0;1;0;0;0
982;fuck not munafik or shit but fuck #marathonseason lets goooooo;0;0;0;0;0;0;0;0;0;0;0;0;fuck not munafik orang shit but fuck marathon season lets go;0;1;0;0;0;0;0;0;0;0;0;0
983;Antek komunis nya jelas sekali... Yang teriak huuuu ke Bp. Taufik Ismail -hafizhahullah URL;1;0;0;1;0;1;0;0;0;0;1;0;antek komunis  jelas sekali  teriak  ke bapak taufik ismail hafizhahullah url;1;0;0;0;0;1;0;0;0;0;0;0
986;USER Pabrik sj mrk sweeping krn tdk mengikuti peraturan mrk ,emangnya negara ini milik nenek mrk?sontoloyo mrk';1;1;0;1;0;0;0;0;1;0;1;0;user pabrik saja mereka sweeping karena tidak mengikuti peraturan mereka memangnya negara ini milik nenek mereka sontoloyo mereka ;1;0;0;0;0;0;0;0;1;0;0;0
991;USER USER USER Bawang putih itu sdg kafir haram lagi..\nHiks.hiks..hiks';1;1;1;0;0;0;0;0;1;1;0;0;user user user bawang putih itu sedang kafir haram lagi    ;0;1;0;0;0;0;0;0;0;0;0;0
992;USER USER USER USER USER Kafir ada di Alquran....situ sehat???';0;0;0;0;0;0;0;0;0;0;0;0;user user user user user kafir ada di alquran kamu sehat ;1;1;0;0;1;0;0;0;0;1;0;0
996;USER Indonesia 99% tetap ganti presiden kopanye nang ruhut #2019GantiPresiden #2019.;0;0;0;0;0;0;0;0;0;0;0;0;user indonesia tetap ganti presiden kampanye di ruhut ganti presiden ;1;0;0;0;0;0;0;0;1;0;0;0
1002;Hello world, people in Indonesia never pray like this since our Independence day on August 1945, we did it again since our leader now never protect us and there is no more justice. We need  USER  to be our next President #2019GantiPresiden #TheGreatCampaignOfPrabowo pic.twitter.com/HuAaNwT5Gx;1;0;1;0;0;0;0;0;1;1;0;0; world people in indonesia never pray like this sejak our independence day on august we did it again sejak our leader now never protect us and there is no more justice we need user to be our next presiden ganti presiden the great campaign of prabowo ;0;0;0;0;0;0;0;0;0;0;0;0
