2375;Yes look Qatar, Emirates, they are not democracy but richer than democracy countries. But the world criticize China, Russia, but true their people as a whole poorer than arabs. But in Africa many doing democracy but fuck up, same as Indonesia, Philipines, Ukraine etc;0;1;0;0;0;0;0;0;0;0;0;0;iya look qatar emirates they are not democracy but richer tahan democracy countries but the world criticize cina rusia but true their people as a whole poorer tahan arabs but in africa many doing democracy but fuck up sama as indonesia philipines ukraine etc;0.0;0.0;0.0;0.0;0.0;0.0;0.0;0.0;0.0;0.0;0.0;0.0;en;Yes look Qatar, Emirates, they are not democracy but richer than democracy countries. But the world criticize China, Russia, but true their people as a whole poorer than arabs. But in Africa many doing democracy but fuck up, same as Indonesia, Philipines, Ukraine etc;0;1;0;0;0;0;0;0;0;0;0;0;iya lihat qatar emirates mereka bukan negara demokrasi tapi lebih kaya negara demokrasi tahan tapi dunia mengkritik cina rusia tapi benar rakyat mereka secara keseluruhan lebih miskin tahan arabs tapi di afrika banyak  melakukan demokrasi tapi bercinta sama seperti filipina indonesia ukraina dll;0.0;0.0;0.0;0.0;0.0;0.0;0.0;0.0;0.0;0.0;0.0;0.0;en
2379;kasian tetangganya RT  USER: bangsat HAHAHAHAHA RT fuckboysehun: so whose falsetto is higher when they fuck,,,,;1;1;1;0;0;0;0;0;1;1;0;0;kasihan tetangganya rt user bangsat  rt fuch boy sehun so whose falsetto is higher when they fuck ;1.0;1.0;0.0;1.0;0.0;0.0;0.0;0.0;1.0;0.0;1.0;0.0;en;kasian tetangganya RT  USER: bangsat HAHAHAHAHA RT fuckboysehun: so whose falsetto is higher when they fuck,,,,;1;1;1;0;0;0;0;0;1;1;0;0;terima kasih tetangganya rt pengguna bangsat  rt fuch boy sehun jadi  falsetto lebih tinggi ketika mereka bercinta;1.0;1.0;0.0;1.0;0.0;0.0;0.0;0.0;1.0;0.0;1.0;0.0;en
2388;I appreciate ur ability to point out that #prabowogila without even saying the word ðð;1;1;1;0;0;0;0;0;1;1;0;0;i appreciate kamu ability to point out that prabowo gila tanpa even saying the word ;0.0;1.0;0.0;0.0;0.0;0.0;0.0;0.0;0.0;0.0;0.0;0.0;en;I appreciate ur ability to point out that #prabowogila without even saying the word ðð;1;1;1;0;0;0;0;0;1;1;0;0;saya menghargai kemampuan kamu untuk menunjukkan bahwa prabowo gila tanpa mengatakan kata;0.0;1.0;0.0;0.0;0.0;0.0;0.0;0.0;0.0;0.0;0.0;0.0;en
2398;Dear malaysia what you guys are like that till got to cheat, if you want to look great, should use a good way .. #ShameOnYouMalaysia;1;0;0;1;0;0;0;0;1;0;1;0;dear malaysia apa you guys are like that till got to cheat if you want to look great should use a good way shame on you malaysia;0.0;0.0;0.0;0.0;0.0;0.0;0.0;0.0;0.0;0.0;0.0;0.0;en;Dear malaysia what you guys are like that till got to cheat, if you want to look great, should use a good way .. #ShameOnYouMalaysia;1;0;0;1;0;0;0;0;1;0;1;0;sayang malaysia apa kalian seperti itu sampai harus menipu jika kamu ingin terlihat hebat harus menggunakan cara  baik malu pada kamu malaysia;0.0;0.0;0.0;0.0;0.0;0.0;0.0;0.0;0.0;0.0;0.0;0.0;en
2400;"JUST HOW MANY TIMES I WATCHED THIS I ALWAYS LAUGH AT 
""COKLAT SI ANJING COKLAT"" PART  https://twitter.com/msq_________/status/1223901399555039232Â â¦";0;0;0;0;0;0;0;0;0;0;0;0;just how many times i watched this i always laugh at coklat  anjing coklat part ;0.0;1.0;0.0;0.0;0.0;0.0;0.0;0.0;0.0;0.0;0.0;0.0;en;"JUST HOW MANY TIMES I WATCHED THIS I ALWAYS LAUGH AT 
""COKLAT SI ANJING COKLAT"" PART  https://twitter.com/msq_________/status/1223901399555039232Â â¦";0;0;0;0;0;0;0;0;0;0;0;0;hanya berapa kali saya menonton ini saya selalu menertawakan bagian coklat  anjing coklat;0.0;1.0;0.0;0.0;0.0;0.0;0.0;0.0;0.0;0.0;0.0;0.0;en
2412;"""REVOLUSI MENTAL"" a whole fcking joke tell by a big liar  USER ð¤¢  https://twitter.com/bos_sir/status/1180715038119608327Â â¦";0;1;0;0;0;0;0;0;0;0;0;0;revolusi mental a whole fuck joke tell by a besar liar user ;1.0;1.0;1.0;0.0;0.0;0.0;0.0;0.0;1.0;1.0;0.0;0.0;en;"""REVOLUSI MENTAL"" a whole fcking joke tell by a big liar  USER ð¤¢  https://twitter.com/bos_sir/status/1180715038119608327Â â¦";0;1;0;0;0;0;0;0;0;0;0;0;revolusi mental  bercanda bercanda diceritakan oleh pengguna pembohong besar;1.0;0.0;1.0;0.0;0.0;0.0;0.0;0.0;1.0;1.0;0.0;0.0;en
2470;111 gold medal!!!!!! Why you guy still 0 Olympic gold medal ? Because you never be host of the Olympic Games #TeamMAS #ShameOnYouMalaysia;1;0;0;1;0;0;0;0;1;0;1;0; gold medal kenapa you guy still olympic gold medal because you never be host of the olympic games team mas shame on you malaysia;0.0;0.0;0.0;0.0;0.0;0.0;0.0;0.0;0.0;0.0;0.0;0.0;en;111 gold medal!!!!!! Why you guy still 0 Olympic gold medal ? Because you never be host of the Olympic Games #TeamMAS #ShameOnYouMalaysia;1;0;0;1;0;0;0;0;1;0;1;0; medali emas mengapa kalian masih medali emas olimpiade karena kamu tidak pernah menjadi tuan rumah tim pertandingan olimpiade mas malu pada kamu malaysia;0.0;0.0;0.0;0.0;0.0;0.0;0.0;0.0;0.0;0.0;0.0;0.0;en
2472;"As a dominant guy, I think u need to be an Alpha, aren't you? Idc if you're saying that I'm a gold digger or smth, but I think you're just saying ""let's pay our own bills"" in other ways. Trs lo modal apa? Kontol doang?";1;1;1;0;0;0;0;0;1;1;0;0;as a dominant guy i think kamu need to be an alpha are not you i do not care if you are saying that i sama a gold digger orang something but i think you are just saying let pay our own bills in other arah terus kamu modal apa kontol saja ;0.0;1.0;0.0;0.0;0.0;0.0;0.0;0.0;0.0;0.0;0.0;0.0;en;"As a dominant guy, I think u need to be an Alpha, aren't you? Idc if you're saying that I'm a gold digger or smth, but I think you're just saying ""let's pay our own bills"" in other ways. Trs lo modal apa? Kontol doang?";1;1;1;0;0;0;0;0;1;1;0;0;sebagai orang  dominan saya pikir kamu perlu menjadi alfa bukan kamu saya tidak peduli jika kamu mengatakan bahwa saya sama seorang penggali emas orang sesuatu tapi saya pikir kamu hanya mengatakan biarkan membayar tagihan kita sendiri di lain arah terus kamu modal apa kontol saja;0.0;1.0;0.0;0.0;0.0;0.0;0.0;0.0;0.0;0.0;0.0;0.0;en
2487;#MiddleFinger #ShameOnYouMalaysia #NoDignity   I would be embarassed to win by cheating. My whole family would feel the same. https://twitter.com/pizzuzomiii62/status/902053102508838912Â â¦;1;0;0;1;0;0;0;0;1;0;1;0; middle finger shame on you malaysia nodignity i would be embarrassed to menang by cheating my whole family would feel the sama ;0.0;0.0;0.0;0.0;0.0;0.0;0.0;0.0;0.0;0.0;0.0;0.0;en;#MiddleFinger #ShameOnYouMalaysia #NoDignity   I would be embarassed to win by cheating. My whole family would feel the same. https://twitter.com/pizzuzomiii62/status/902053102508838912Â â¦;1;0;0;1;0;0;0;0;1;0;1;0;malu jari tengah pada anda malaysia nodignity saya akan malu untuk menang dengan menipu seluruh keluarga saya akan merasakan hal  sama;0.0;0.0;0.0;0.0;0.0;0.0;0.0;0.0;0.0;0.0;0.0;0.0;en
2491;Munafik  USER  no love  with his fellow Muslims. Spineless like snail;1;0;1;0;0;0;0;0;1;1;0;0;munafik user no love dengan his fellow muslims spineless like snail;0.0;0.0;0.0;0.0;0.0;0.0;0.0;0.0;0.0;0.0;0.0;0.0;en;Munafik  USER  no love  with his fellow Muslims. Spineless like snail;1;0;1;0;0;0;0;0;1;1;0;0;pengguna munafik tidak ada cinta dengan sesama muslimnya tak berdaya seperti siput;0.0;0.0;0.0;0.0;0.0;0.0;0.0;0.0;0.0;0.0;0.0;0.0;en
2506;"Hey who would love to feed on diz meal I prepared
#GoodFriday #MCITOT #EasterWeekend #FridayFeeling #happyEaster2019 #Easter #Ghana #PrabowoGila #UtoMarketFreeBitCoin pic.twitter.com/h9cAzNGefN";0;0;0;0;0;0;0;0;0;0;0;0;he who would love to feed on diz meal i prepared good friday mcitot easter weekend friday feeling happy easter easter ghana prabowo gila utomarketfreebitcoin ;1.0;1.0;1.0;0.0;0.0;0.0;0.0;0.0;1.0;1.0;0.0;0.0;en;"Hey who would love to feed on diz meal I prepared
#GoodFriday #MCITOT #EasterWeekend #FridayFeeling #happyEaster2019 #Easter #Ghana #PrabowoGila #UtoMarketFreeBitCoin pic.twitter.com/h9cAzNGefN";0;0;0;0;0;0;0;0;0;0;0;0;dia  ingin makan diz makan aku siap jumat  baik mcitot akhir pekan paskah jumat perasaan senang paskah paskah ghana prabowo gila utomarketfreebitcoin;1.0;1.0;1.0;0.0;0.0;0.0;0.0;0.0;1.0;1.0;0.0;0.0;en
2598;"Hey guy  USER ! What kind of person you are?? You just talked so kind enough but you've also posted and called HIM ""YESUS"" KADAL GURUN in your pic??!! How come?!! Didn't it show that we're arguing with such a STUPID person??!!";1;1;1;0;0;0;0;0;1;1;0;0;he guy user apa kind of person you are you just talked so kind enough but you ve also posted and called him yesus kadal gurun in your pic how come did not it show that we are arguing dengan such a bodoh person ;0.0;1.0;0.0;0.0;0.0;0.0;0.0;0.0;0.0;0.0;0.0;0.0;en;"Hey guy  USER ! What kind of person you are?? You just talked so kind enough but you've also posted and called HIM ""YESUS"" KADAL GURUN in your pic??!! How come?!! Didn't it show that we're arguing with such a STUPID person??!!";1;1;1;0;0;0;0;0;1;1;0;0;he guy user apa jenis orang kamu kamu baru saja bicara begitu baik tetapi kamu juga sudah memposting dan memanggilnya yesus kadal gurun di fotomu bagaimana mungkin itu tidak menunjukkan bahwa kita sedang berdebat dengan orang bodoh seperti itu;0.0;0.0;0.0;0.0;0.0;0.0;0.0;0.0;0.0;0.0;0.0;0.0;en
2607;There's no difference between munafik and hypocrite. Both are you;1;0;1;0;0;0;0;0;1;1;0;0;there no difference between munafik and hypocrite both are you;0.0;0.0;0.0;0.0;0.0;0.0;0.0;0.0;0.0;0.0;0.0;0.0;en;There's no difference between munafik and hypocrite. Both are you;1;0;1;0;0;0;0;0;1;1;0;0;tidak ada perbedaan antara munafik dan munafik keduanya;0.0;0.0;0.0;0.0;0.0;0.0;0.0;0.0;0.0;0.0;0.0;0.0;en
2609;"I think Trump just somebody who loves his country thus demonizing everyone. this sounds familiar-""DAP kafir harbi,Cina nak jatuhkan Islam""  https://twitter.com/realDonaldTrump/status/828042506851934209Â â¦";1;1;1;0;1;1;0;0;0;1;0;0;i think trump just somebody who loves his country thus demonizing everyone this sounds familiar dap kafir harbi cina nak jatuhkan islam ;0.0;1.0;0.0;0.0;0.0;0.0;0.0;0.0;0.0;0.0;0.0;0.0;en;"I think Trump just somebody who loves his country thus demonizing everyone. this sounds familiar-""DAP kafir harbi,Cina nak jatuhkan Islam""  https://twitter.com/realDonaldTrump/status/828042506851934209Â â¦";1;1;1;0;1;1;0;0;0;1;0;0;saya pikir truf hanya seseorang  mencintai negaranya sehingga menjelekkan semua orang ini terdengar akrab dap kafir harbi cina nak jatuhkan islam;0.0;1.0;0.0;0.0;0.0;0.0;0.0;0.0;0.0;0.0;0.0;0.0;en
2612;"Indonesia is the ideal battle ground for them who plan to establish global caliphate. It is a democratic country with the largest moslem population in the world. Fighting against this movement is not harming democracy. 
 https://www.google.com/amp/s/www.radarmadura.id/berita-sekitar-anda/bali/reuni-212-bernuansa-politis-patut-ditolak/amp/Â â¦";1;0;0;1;1;0;0;0;0;0;1;0;indonesia is the ideal battle ground for them who plan to establish global caliphate it is a democratic country dengan the largest moslem population in the world fighting against this movement is not harming democracy ;0.0;0.0;0.0;0.0;0.0;0.0;0.0;0.0;0.0;0.0;0.0;0.0;en;"Indonesia is the ideal battle ground for them who plan to establish global caliphate. It is a democratic country with the largest moslem population in the world. Fighting against this movement is not harming democracy. 
 https://www.google.com/amp/s/www.radarmadura.id/berita-sekitar-anda/bali/reuni-212-bernuansa-politis-patut-ditolak/amp/Â â¦";1;0;0;1;1;0;0;0;0;0;1;0;indonesia adalah tempat pertempuran  ideal bagi mereka  berencana mendirikan kekhalifahan global indonesia adalah negara demokratis dengan populasi muslim terbesar di dunia  berjuang melawan gerakan ini tidak merugikan demokrasi ;0.0;0.0;0.0;0.0;0.0;0.0;0.0;0.0;0.0;0.0;0.0;0.0;en
2628;You are very wrong on this. Prabowo mass mobilized themselves. Jokowi mass are paid. Just see. The people will not let our victory be robbed. #2019GantiPresiden was and is our mission  We have all the reasons and proofs (C1 documents) that we won.;1;0;0;1;0;0;0;0;1;0;1;0;you are sangat salah on this prabowo mass mobilized themselves jokowi mass are paid just see the people will not let our victory be robbed ganti presiden was and is our mission we have all the reasons and proofs c documents that we won ;0.0;0.0;0.0;0.0;0.0;0.0;0.0;0.0;0.0;0.0;0.0;0.0;en;You are very wrong on this. Prabowo mass mobilized themselves. Jokowi mass are paid. Just see. The people will not let our victory be robbed. #2019GantiPresiden was and is our mission  We have all the reasons and proofs (C1 documents) that we won.;1;0;0;1;0;0;0;0;1;0;1;0;anda sangat salah pada massa prabowo ini memobilisasi diri mereka massa jokowi dibayar hanya melihat orang tidak akan membiarkan kemenangan kita dirampok ganti presiden adalah dan misi kami kami memiliki semua alasan dan bukti dokumen c  kami menangkan;0.0;0.0;0.0;0.0;0.0;0.0;0.0;0.0;0.0;0.0;0.0;0.0;en
2640;Exactly, and no one spoke anything when Kashmiris were being butchered daily in streets, in their own homes....these munafik elites so-called Muslims deserve what they're getting (not including middle class/poor Muslims).  https://twitter.com/Haqeeqat_TV/status/1205818762659807233Â â¦;1;0;0;1;1;0;0;0;0;0;1;0;exactly and no one spoke anything when kashmiris were being butchered daily in streets in their own homes these munafik elites so called muslims deserve apa they are getting not including tengah class poor muslims ;0.0;0.0;0.0;0.0;0.0;0.0;0.0;0.0;0.0;0.0;0.0;0.0;en;Exactly, and no one spoke anything when Kashmiris were being butchered daily in streets, in their own homes....these munafik elites so-called Muslims deserve what they're getting (not including middle class/poor Muslims).  https://twitter.com/Haqeeqat_TV/status/1205818762659807233Â â¦;1;0;0;1;1;0;0;0;0;0;1;0;persis dan tidak ada  berbicara apa apa ketika kashmir dibantai setiap hari di jalan jalan di rumah mereka sendiri para elit munafik ini disebut muslim berhak mendapatkan apa  mereka dapatkan tidak termasuk kelas menengah muslim miskin;0.0;0.0;0.0;0.0;0.0;0.0;0.0;0.0;0.0;0.0;0.0;0.0;en
2660;" USER bro you're not his friend even if you are his friend, you better not saying anjing dan bangsar word to him
You don't know him asshole";1;1;1;0;0;0;0;0;1;1;0;0; user bro you are not his friend even if you are his friend you better not saying anjing dan bangsar word to him you do not know him asshole;0.0;1.0;0.0;0.0;0.0;0.0;0.0;0.0;0.0;0.0;0.0;0.0;en;" USER bro you're not his friend even if you are his friend, you better not saying anjing dan bangsar word to him
You don't know him asshole";1;1;1;0;0;0;0;0;1;1;0;0;pengguna bro anda bukan temannya bahkan jika anda adalah temannya anda sebaiknya tidak mengatakan anjing dan bangsar kata kepadanya anda tidak tahu dia brengsek;0.0;1.0;0.0;0.0;0.0;0.0;0.0;0.0;0.0;0.0;0.0;0.0;en
2672;This copper medal of timor-leste is worth than those gold medals of Malaysia #SEAGames2017 #ShameOnYouMalaysia  pic.twitter.com/pWar3DOkbp;1;0;0;1;0;0;0;0;1;0;1;0;this copper medal of timor leste is worth tahan those gold medals of malaysia sea games shame on you malaysia ;0.0;0.0;0.0;0.0;0.0;0.0;0.0;0.0;0.0;0.0;0.0;0.0;en;This copper medal of timor-leste is worth than those gold medals of Malaysia #SEAGames2017 #ShameOnYouMalaysia  pic.twitter.com/pWar3DOkbp;1;0;0;1;0;0;0;0;1;0;1;0;medali tembaga ini dari timor leste layak tahan medali emas pertandingan laut malaysia memalukan kamu malaysia;0.0;0.0;0.0;0.0;0.0;0.0;0.0;0.0;0.0;0.0;0.0;0.0;en
2713;Still hating on malaysia huh guys? Cannot redha that you already kalah huh and still using the hashtag #ShameOnYouMalaysia childish much ð;1;0;0;1;0;0;0;0;1;0;1;0;still hating on malaysia  guys cannot redha that you already kalah  and still using the tagar shame on you malaysia childish much ;0.0;0.0;0.0;0.0;0.0;0.0;0.0;0.0;0.0;0.0;0.0;0.0;en;Still hating on malaysia huh guys? Cannot redha that you already kalah huh and still using the hashtag #ShameOnYouMalaysia childish much ð;1;0;0;1;0;0;0;0;1;0;1;0;masih membenci di malaysia  teman tidak bisa redha bahwa anda sudah kalah  dan masih menggunakan tagar malu pada anda malaysia banyak kekanak kanakan;0.0;0.0;0.0;0.0;0.0;0.0;0.0;0.0;0.0;0.0;0.0;0.0;en
2722;I'm a liar and you're munafik;1;1;1;0;0;0;0;0;1;1;0;0;i sama a liar and you are munafik;1.0;0.0;1.0;0.0;0.0;0.0;0.0;0.0;1.0;1.0;0.0;0.0;en;I'm a liar and you're munafik;1;1;1;0;0;0;0;0;1;1;0;0;saya sama pembohong dan anda munafik;1.0;0.0;1.0;0.0;0.0;0.0;0.0;0.0;1.0;1.0;0.0;0.0;en
2736;"Dah kalau wifi mcm bangsat hg expect mobile data would be your savior but NEIN ""fuck you and your dumb ass internet connection"" -celcom,,,,";0;1;0;0;0;0;0;0;0;0;0;0;sudah kalau wifi macam bangsat hg expect mobile data would be your savior but nein fuck you and your dumb ass internet connection celcom ;1.0;1.0;1.0;0.0;0.0;0.0;0.0;0.0;1.0;1.0;0.0;0.0;en;"Dah kalau wifi mcm bangsat hg expect mobile data would be your savior but NEIN ""fuck you and your dumb ass internet connection"" -celcom,,,,";0;1;0;0;0;0;0;0;0;0;0;0;sudah jika wifi macam bangsat hg berharap data seluler akan menjadi penyelamat anda tapi nein bercinta anda dan anda bodoh koneksi internet celcom;1.0;1.0;1.0;0.0;0.0;0.0;0.0;0.0;1.0;1.0;0.0;0.0;en
2739;You can debate Prabowo's existing history about HAM abuse, how Jokowi hasn't took any action of the Aksi Kamisan thingy and ascending inter-religious disharmony. Instead, he took a jab of a damn tabloid issue and couldn't control his breath. Shame.;1;0;1;0;0;0;0;0;1;1;0;0;you can debate prabowo existing histori about hak asasi manusia abuse how jokowi has not took any action of the aksi kamisan thingy and ascending inter religious disharmony instead he took a jab of a damn tabloid isu and could not control his breath shame ;0.0;0.0;0.0;0.0;0.0;0.0;0.0;0.0;0.0;0.0;0.0;0.0;en;You can debate Prabowo's existing history about HAM abuse, how Jokowi hasn't took any action of the Aksi Kamisan thingy and ascending inter-religious disharmony. Instead, he took a jab of a damn tabloid issue and couldn't control his breath. Shame.;1;0;1;0;0;0;0;0;1;1;0;0;anda dapat memperdebatkan prabowo histori  ada tentang pelanggaran hak asasi manusia bagaimana jokowi belum mengambil tindakan apapun dari aksi kamisan dan naik turunnya ketidakharmonisan antaragama alih alih dia mengambil suntikan tabloid sialan dan tidak bisa mengendalikan nafasnya karena malu;0.0;0.0;0.0;0.0;0.0;0.0;0.0;0.0;0.0;0.0;0.0;0.0;en
2747;"That is the ignorance that is being done by Prabowo and his Success Team, not acknowledging defeat and finally making confusion and lies to the public and its supporters. It's true that his thoughts have gone crazy.
#PrabowoMenangHoax
#PrabowoGila";1;1;0;1;0;0;0;0;1;0;1;0;that is the ignorance that is being done by prabowo and his sukses tim not acknowledging defeat and finally making confusion and lies to the publik and it is supporters it true that his thoughts have gone crazy prabowo menang hoax prabowo gila;0.0;0.0;0.0;0.0;0.0;0.0;0.0;0.0;0.0;0.0;0.0;0.0;en;"That is the ignorance that is being done by Prabowo and his Success Team, not acknowledging defeat and finally making confusion and lies to the public and its supporters. It's true that his thoughts have gone crazy.
#PrabowoMenangHoax
#PrabowoGila";1;1;0;1;0;0;0;0;1;0;1;0;itu adalah ketidaktahuan  dilakukan oleh prabowo dan tim suksesnya tidak mengakui kekalahan dan akhirnya membuat kebingungan dan kebohongan kepada publik dan memang pendukungnya benar bahwa pikirannya sudah gila prabowo menang hoax prabowo gila;1.0;1.0;1.0;0.0;0.0;0.0;0.0;0.0;1.0;1.0;0.0;0.0;en
2748;white people are also kampungan and some of y'all still glorify them? The stench of it all,,,,  https://twitter.com/redditindonesia/status/1174961266365882368Â â¦;1;1;0;1;0;1;0;0;0;0;1;0;white people are also kampungan and some of iya all still glorify them the stench of it all ;0.0;1.0;0.0;0.0;0.0;0.0;0.0;0.0;0.0;0.0;0.0;0.0;en;white people are also kampungan and some of y'all still glorify them? The stench of it all,,,,  https://twitter.com/redditindonesia/status/1174961266365882368Â â¦;1;1;0;1;0;1;0;0;0;0;1;0;orang kulit putih juga kampungan dan beberapa dari mereka semua masih memuliakan mereka semua;0.0;1.0;0.0;0.0;0.0;0.0;0.0;0.0;0.0;0.0;0.0;0.0;en
2766;"Hi,  USER  and  USER ! Malacanan is saying that you are both liars.

  https://twitter.com/ABSCBNNews/status/775239876966887424Â â¦";1;0;0;1;0;0;0;0;1;0;1;0; user and user malacanan is saying that you are both liars ;0.0;0.0;0.0;0.0;0.0;0.0;0.0;0.0;0.0;0.0;0.0;0.0;en;"Hi,  USER  and  USER ! Malacanan is saying that you are both liars.

  https://twitter.com/ABSCBNNews/status/775239876966887424Â â¦";1;0;0;1;0;0;0;0;1;0;1;0;pengguna  dan pengguna malacanan mengatakan bahwa anda berdua pembohong;1.0;0.0;1.0;0.0;0.0;0.0;0.0;0.0;1.0;1.0;0.0;0.0;en
2781;"what vibes do kozan's give off?

    ð â chill vibes
ãð³ â shy vibes
ãð â gay vibes
ãð â goblok vibes
ãðª â edgy vibes
ãð¸ â soft vibes
ãð¨ â artist vibes
ãð­ â sad vibes
ãð â happy vibes
ãð â horny vibes
ãð â cynical vibes
    ð â cute vibes
    â ï¸ â bct vibes";0;1;0;0;0;0;0;0;0;0;0;0;apa vibes do kozan give off chill vibes shy vibes gay vibes goblok vibes edgy vibes lembut vibes artist vibes sad vibes happy vibes horny vibes cynical vibes cute vibes bacot vibes;0.0;0.0;0.0;0.0;0.0;0.0;0.0;0.0;0.0;0.0;0.0;0.0;en;"what vibes do kozan's give off?

    ð â chill vibes
ãð³ â shy vibes
ãð â gay vibes
ãð â goblok vibes
ãðª â edgy vibes
ãð¸ â soft vibes
ãð¨ â artist vibes
ãð­ â sad vibes
ãð â happy vibes
ãð â horny vibes
ãð â cynical vibes
    ð â cute vibes
    â ï¸ â bct vibes";0;1;0;0;0;0;0;0;0;0;0;0;apa getaran melakukan kozan melepaskan getaran dingin suasana malu gay vibe goblok vibe edgy vibe getaran lembut artis vibe vibe sedih vibe bahagia vibe horny vibe sinis vibe vibe lucu bacot vibe;1.0;1.0;1.0;0.0;0.0;0.0;0.0;0.0;1.0;1.0;0.0;0.0;en
2797;Fuck give away kingdom.. bangsa BAR2 anjing #ShameOnYouSyedSaddiq;1;1;0;1;0;0;0;0;1;0;1;0;fuck give away kingdom bangsa bar bar anjing shame on you syed saddiq;0.0;1.0;0.0;0.0;0.0;0.0;0.0;0.0;0.0;0.0;0.0;0.0;en;Fuck give away kingdom.. bangsa BAR2 anjing #ShameOnYouSyedSaddiq;1;1;0;1;0;0;0;0;1;0;1;0;bercinta memberikan kerajaan bar bangsa anjing malu pada anda syed saddiq;0.0;1.0;0.0;0.0;0.0;0.0;0.0;0.0;0.0;0.0;0.0;0.0;en
2800;fuck off la let me teach you how to be bitch and stop ruin my relay bangsat,,,,;1;1;1;0;0;0;0;0;1;1;0;0;fuck off  let me teach you how to be bitch and stop ruin my relay bangsat ;0.0;1.0;0.0;0.0;0.0;0.0;0.0;0.0;0.0;0.0;0.0;0.0;en;fuck off la let me teach you how to be bitch and stop ruin my relay bangsat,,,,;1;1;1;0;0;0;0;0;1;1;0;0;persetan  biarkan aku mengajarimu bagaimana menjadi pelacur dan berhenti merusak bangsat ku;0.0;1.0;0.0;0.0;0.0;0.0;0.0;0.0;0.0;0.0;0.0;0.0;en
2808;well-o I'm feeling like a loser now, since I didn't participate at #indonesiaelection;0;1;0;0;0;0;0;0;0;0;0;0;well o i sama feeling like a loser now sejak i did not participate at indonesia election;0.0;0.0;0.0;0.0;0.0;0.0;0.0;0.0;0.0;0.0;0.0;0.0;en;well-o I'm feeling like a loser now, since I didn't participate at #indonesiaelection;0;1;0;0;0;0;0;0;0;0;0;0;well  sama merasa seperti pecundang sekarang karena saya tidak berpartisipasi dalam pemilihan indonesia;0.0;0.0;0.0;0.0;0.0;0.0;0.0;0.0;0.0;0.0;0.0;0.0;en
2812;You faithful and pious servant of Chinese! How much do they pay for you to slander Uyghurs? You are a munafik.;1;0;1;0;0;0;0;0;1;1;0;0;you faithful and pious servant of cina how much do they pay for you to slander uyghurs you are a munafik ;0.0;0.0;0.0;0.0;0.0;0.0;0.0;0.0;0.0;0.0;0.0;0.0;en;You faithful and pious servant of Chinese! How much do they pay for you to slander Uyghurs? You are a munafik.;1;0;1;0;0;0;0;0;1;1;0;0;anda hamba  setia dan saleh dari cina berapa banyak mereka membayar anda untuk memfitnah anda adalah seorang munafik;0.0;0.0;0.0;0.0;0.0;0.0;0.0;0.0;0.0;0.0;0.0;0.0;en
2834;Worth to watch. Cant believe we have that bejat person rule the best airlines in Indonesia  https://twitter.com/digeeembok/status/1201777904264216576Â â¦;1;1;1;0;0;0;0;0;1;1;0;0;worth to watch cant believe we have that bejat person rule the best airlines in indonesia ;0.0;0.0;0.0;0.0;0.0;0.0;0.0;0.0;0.0;0.0;0.0;0.0;en;Worth to watch. Cant believe we have that bejat person rule the best airlines in Indonesia  https://twitter.com/digeeembok/status/1201777904264216576Â â¦;1;1;1;0;0;0;0;0;1;1;0;0;layak untuk menonton tidak percaya kita memiliki orang bejat  memerintah maskapai penerbangan terbaik di indonesia;0.0;0.0;0.0;0.0;0.0;0.0;0.0;0.0;0.0;0.0;0.0;0.0;en
2877;I just ordered a batch of Coronavirus masks im wearing at all tines #fuck #China eating bats and snakes & feeding their toddlers live tadpoles fuck China off;1;1;0;1;0;0;0;0;1;0;1;0;i just ordered a batch of coronavirus masks i am wearing at all tines fuck cina eating bats and snakes feeding their toddlers live tadpoles fuck cina off;0.0;1.0;0.0;0.0;0.0;0.0;0.0;0.0;0.0;0.0;0.0;0.0;en;I just ordered a batch of Coronavirus masks im wearing at all tines #fuck #China eating bats and snakes & feeding their toddlers live tadpoles fuck China off;1;1;0;1;0;0;0;0;1;0;1;0;saya baru saja memesan sejumlah masker coronavirus  saya kenakan sama sekali bercinta cina makan kelelawar dan ular memberi makan balita mereka hidup berudu bercinta cina pergi;0.0;1.0;0.0;0.0;0.0;0.0;0.0;0.0;0.0;0.0;0.0;0.0;en
